ticker,company,date,month,source,headline,sentiment_label,sentiment_confidence,sentiment_score
RGTI,Rigetti Computing Inc,2024-10-21,2024-10,google,Can Uber Stock Cruise to $100 After Q3 Earnings? - CryptoRank Can Uber Stock Cruise to $100 After Q3 Earnings?  CryptoRank,neutral,0.8811591863632202,0.0
RGTI,Rigetti Computing Inc,2024-10-08,2024-10,google,D-Wave and Rigetti Face Potential Delisting Amid Stock Price Slumps - Yahoo Finance D-Wave and Rigetti Face Potential Delisting Amid Stock Price Slumps  Yahoo Finance,negative,0.7928313612937927,-0.7928313612937927
RGTI,Rigetti Computing Inc,2024-11-19,2024-11,google,"Investors Heavily Search Rigetti Computing, Inc. (RGTI): Here is What You Need to Know - Yahoo Finance Investors Heavily Search Rigetti Computing, Inc. (RGTI): Here is What You Need to Know  Yahoo Finance",neutral,0.9459161758422852,0.0
RGTI,Rigetti Computing Inc,2024-11-26,2024-11,google,"RGTI Surges 97% YTD: Should You Buy, Hold or Sell the Stock? - Nasdaq RGTI Surges 97% YTD: Should You Buy, Hold or Sell the Stock?  Nasdaq",neutral,0.8598295450210571,0.0
RGTI,Rigetti Computing Inc,2024-11-29,2024-11,google,Quantum Stocks: Weighing The Bullish and Bearish Cases - The Quantum Insider Quantum Stocks: Weighing The Bullish and Bearish Cases  The Quantum Insider,neutral,0.9252455234527588,0.0
RGTI,Rigetti Computing Inc,2024-11-23,2024-11,google,"Market Participants Recognise Rigetti Computing, Inc.'s (NASDAQ:RGTI) Revenues Pushing Shares 44% Higher - simplywall.st Market Participants Recognise Rigetti Computing, Inc.'s (NASDAQ:RGTI) Revenues Pushing Shares 44% Higher  simplywall.st",positive,0.6872007250785828,0.6872007250785828
RGTI,Rigetti Computing Inc,2024-11-24,2024-11,google,Rigetti Computing: Could This Be The Next Quantum Multibagger? - Seeking Alpha Rigetti Computing: Could This Be The Next Quantum Multibagger?  Seeking Alpha,neutral,0.9244843125343323,0.0
RGTI,Rigetti Computing Inc,2024-11-25,2024-11,google,How Rigetti’s Quantum Leap Could Transform the Stock Market - timothysykes.com How Rigetti’s Quantum Leap Could Transform the Stock Market  timothysykes.com,neutral,0.9299225211143494,0.0
RGTI,Rigetti Computing Inc,2024-11-11,2024-11,google,Rigetti Computing Inc (RGTI) Q3 2024 Earnings Report Preview: What To Look For - Yahoo Finance Rigetti Computing Inc (RGTI) Q3 2024 Earnings Report Preview: What To Look For  Yahoo Finance,neutral,0.9147520065307617,0.0
RGTI,Rigetti Computing Inc,2024-11-27,2024-11,google,Rigetti Computing (RGTI) Makes Significant Strides in Quantum Computing - Nasdaq Rigetti Computing (RGTI) Makes Significant Strides in Quantum Computing  Nasdaq,positive,0.8537421226501465,0.8537421226501465
RGTI,Rigetti Computing Inc,2024-11-15,2024-11,google,Walt Disney Stock (DIS) Jumps as Earnings Top Estimates - CryptoRank Walt Disney Stock (DIS) Jumps as Earnings Top Estimates  CryptoRank,positive,0.7597874402999878,0.7597874402999878
RGTI,Rigetti Computing Inc,2024-12-28,2024-12,google,Rigetti Computing Inc. (RGTI) Ends Trading Week Defying Market Bloodbath - Yahoo Finance Rigetti Computing Inc. (RGTI) Ends Trading Week Defying Market Bloodbath  Yahoo Finance,neutral,0.7144226431846619,0.0
RGTI,Rigetti Computing Inc,2024-12-17,2024-12,google,What's Behind The 500% Rise In RGTI Stock? - Forbes What's Behind The 500% Rise In RGTI Stock?  Forbes,neutral,0.8608025908470154,0.0
RGTI,Rigetti Computing Inc,2024-12-11,2024-12,google,Rigetti Computing: The NVIDIA Of Quantum Computing (NASDAQ:RGTI) - Seeking Alpha Rigetti Computing: The NVIDIA Of Quantum Computing (NASDAQ:RGTI)  Seeking Alpha,neutral,0.920799732208252,0.0
RGTI,Rigetti Computing Inc,2024-12-27,2024-12,google,"RGTI, QSI, QMCO, IONQ stocks are surging: time to short them? - Invezz RGTI, QSI, QMCO, IONQ stocks are surging: time to short them?  Invezz",neutral,0.8961554169654846,0.0
RGTI,Rigetti Computing Inc,2024-12-20,2024-12,google,"Is Under $10 RGTI Stock the Next 2025 NVIDIA, and Is It a Buy? - Zacks Investment Research Is Under $10 RGTI Stock the Next 2025 NVIDIA, and Is It a Buy?  Zacks Investment Research",neutral,0.9459695219993591,0.0
RGTI,Rigetti Computing Inc,2024-12-12,2024-12,google,Rigetti Computing Update: RGTI Stock Maintains Price After Monumental Rally - TipRanks Rigetti Computing Update: RGTI Stock Maintains Price After Monumental Rally  TipRanks,neutral,0.9294624924659729,0.0
RGTI,Rigetti Computing Inc,2024-12-06,2024-12,google,Rigetti Computing stock soars to 52-week high of $3.67 - Investing.com Rigetti Computing stock soars to 52-week high of $3.67  Investing.com,positive,0.808686375617981,0.808686375617981
RGTI,Rigetti Computing Inc,2024-12-20,2024-12,google,Massive News for Rigetti Stock Investors - The Motley Fool Massive News for Rigetti Stock Investors  The Motley Fool,neutral,0.9145025014877319,0.0
RGTI,Rigetti Computing Inc,2024-12-04,2024-12,google,"Rigetti Computing, Inc. (RGTI) Is a Trending Stock: Facts to Know Before Betting on It - Yahoo Finance Rigetti Computing, Inc. (RGTI) Is a Trending Stock: Facts to Know Before Betting on It  Yahoo Finance",neutral,0.9476197957992554,0.0
RGTI,Rigetti Computing Inc,2024-12-15,2024-12,google,Rigetti Computing: Short-Lived Hype (NASDAQ:RGTI) - Seeking Alpha Rigetti Computing: Short-Lived Hype (NASDAQ:RGTI)  Seeking Alpha,neutral,0.9432085156440735,0.0
RGTI,Rigetti Computing Inc,2024-12-23,2024-12,google,Quantum Leap: Rigetti (RGTI) Stock Soars on Cutting-Edge Ankaa-3 System - Yahoo Finance Quantum Leap: Rigetti (RGTI) Stock Soars on Cutting-Edge Ankaa-3 System  Yahoo Finance,neutral,0.8491014838218689,0.0
RGTI,Rigetti Computing Inc,2024-12-28,2024-12,google,"Jim Cramer on Rigetti Computing, Inc. (RGTI): ‘I Am Not A Believer At This Stage’ - Yahoo Finance Jim Cramer on Rigetti Computing, Inc. (RGTI): ‘I Am Not A Believer At This Stage’  Yahoo Finance",neutral,0.9013538360595703,0.0
RGTI,Rigetti Computing Inc,2024-12-17,2024-12,google,"Rigetti Computing, Inc. (RGTI) is Attracting Investor Attention: Here is What You Should Know - Yahoo Finance Rigetti Computing, Inc. (RGTI) is Attracting Investor Attention: Here is What You Should Know  Yahoo Finance",neutral,0.9276880621910095,0.0
RGTI,Rigetti Computing Inc,2024-12-13,2024-12,google,Brokers Suggest Investing in Rigetti Computing (RGTI): Read This Before Placing a Bet - Yahoo Finance Brokers Suggest Investing in Rigetti Computing (RGTI): Read This Before Placing a Bet  Yahoo Finance,neutral,0.9487196803092957,0.0
RGTI,Rigetti Computing Inc,2024-12-19,2024-12,google,Rigetti Computing Surges 692% in a Month: Is There More Room to Jump? - Yahoo Finance Rigetti Computing Surges 692% in a Month: Is There More Room to Jump?  Yahoo Finance,neutral,0.7288692593574524,0.0
RGTI,Rigetti Computing Inc,2024-12-19,2024-12,google,Why Rigetti (RGTI) and D-Wave Quantum Inc. (QBTS) Plunged Today - Yahoo Finance Why Rigetti (RGTI) and D-Wave Quantum Inc. (QBTS) Plunged Today  Yahoo Finance,neutral,0.5360182523727417,0.0
RGTI,Rigetti Computing Inc,2024-12-27,2024-12,google,"Quantum Computing Stocks Surge Amid NASA Contract, Broader Market Momentum - Yahoo Finance Quantum Computing Stocks Surge Amid NASA Contract, Broader Market Momentum  Yahoo Finance",positive,0.6405897736549377,0.6405897736549377
RGTI,Rigetti Computing Inc,2024-12-12,2024-12,google,"Top 2025 Tech Trend: Hold 2 Quantum Computing Stocks, Avoid 1 - Yahoo Finance Top 2025 Tech Trend: Hold 2 Quantum Computing Stocks, Avoid 1  Yahoo Finance",neutral,0.9347590208053589,0.0
RGTI,Rigetti Computing Inc,2024-12-26,2024-12,google,Rigetti Stock Doubles in Days: Here's the Quantum Computing Stock's Next Target - Money Morning Rigetti Stock Doubles in Days: Here's the Quantum Computing Stock's Next Target  Money Morning,neutral,0.9110889434814453,0.0
RGTI,Rigetti Computing Inc,2024-12-27,2024-12,google,3 Quantum Computing Stocks Surging to End the Year - Schaeffer's Investment Research 3 Quantum Computing Stocks Surging to End the Year  Schaeffer's Investment Research,neutral,0.6994006037712097,0.0
RGTI,Rigetti Computing Inc,2025-01-22,2025-01,google,"Rigetti Computing, Inc. (RGTI) Stock Dips While Market Gains: Key Facts - Yahoo Finance Rigetti Computing, Inc. (RGTI) Stock Dips While Market Gains: Key Facts  Yahoo Finance",negative,0.8778930902481079,-0.8778930902481079
RGTI,Rigetti Computing Inc,2025-01-09,2025-01,google,What’s Happening With RGTI Stock? - Forbes What’s Happening With RGTI Stock?  Forbes,neutral,0.8561722636222839,0.0
RGTI,Rigetti Computing Inc,2025-01-10,2025-01,google,"Why Rigetti Computing Stock Skyrocketed 1,449.4% in 2024 but Is Plummeting in 2025 - The Motley Fool Why Rigetti Computing Stock Skyrocketed 1,449.4% in 2024 but Is Plummeting in 2025  The Motley Fool",negative,0.5248453617095947,-0.5248453617095947
RGTI,Rigetti Computing Inc,2025-01-16,2025-01,google,Rigetti Computing: Listen To The CEO Warning (NASDAQ:RGTI) - Seeking Alpha Rigetti Computing: Listen To The CEO Warning (NASDAQ:RGTI)  Seeking Alpha,neutral,0.9349921941757202,0.0
RGTI,Rigetti Computing Inc,2025-01-09,2025-01,google,"After Day of Carnage, Is It Time to Buy Quantum Computing Stocks Again? - 24/7 Wall St. After Day of Carnage, Is It Time to Buy Quantum Computing Stocks Again?  24/7 Wall St.",neutral,0.8897680044174194,0.0
RGTI,Rigetti Computing Inc,2025-01-09,2025-01,google,"Rigetti Computing, Inc. (RGTI): Here’s Why the Stock Crashed - Insider Monkey Rigetti Computing, Inc. (RGTI): Here’s Why the Stock Crashed  Insider Monkey",neutral,0.8858022093772888,0.0
RGTI,Rigetti Computing Inc,2025-01-22,2025-01,google,Rigetti Computing (RGTI) Soars 42.2%: Is Further Upside Left in the Stock? - Yahoo Finance Rigetti Computing (RGTI) Soars 42.2%: Is Further Upside Left in the Stock?  Yahoo Finance,neutral,0.6689417362213135,0.0
RGTI,Rigetti Computing Inc,2025-01-14,2025-01,google,Are Quantum Computing Stocks a Buy in January? - The Motley Fool Are Quantum Computing Stocks a Buy in January?  The Motley Fool,neutral,0.8892799615859985,0.0
RGTI,Rigetti Computing Inc,2025-01-21,2025-01,google,Rigetti Computing: Liquidity Is What Drives Markets (NASDAQ:RGTI) - Seeking Alpha Rigetti Computing: Liquidity Is What Drives Markets (NASDAQ:RGTI)  Seeking Alpha,neutral,0.9268504977226257,0.0
RGTI,Rigetti Computing Inc,2025-01-12,2025-01,google,"Jim Cramer on Rigetti Computing, Inc. (RGTI): ‘The Stock Was Off The Races’ Since November - Yahoo Finance Jim Cramer on Rigetti Computing, Inc. (RGTI): ‘The Stock Was Off The Races’ Since November  Yahoo Finance",negative,0.6475439071655273,-0.6475439071655273
RGTI,Rigetti Computing Inc,2025-01-09,2025-01,google,Why Rigetti Computing Stock Is Plummeting This Week - The Motley Fool Why Rigetti Computing Stock Is Plummeting This Week  The Motley Fool,negative,0.6933795809745789,-0.6933795809745789
RGTI,Rigetti Computing Inc,2025-01-02,2025-01,google,Why Unity Software (U) and Rigetti (RGTI) Are Surging Today - Yahoo Finance Why Unity Software (U) and Rigetti (RGTI) Are Surging Today  Yahoo Finance,neutral,0.4938575029373169,0.0
RGTI,Rigetti Computing Inc,2025-01-14,2025-01,google,"Here’s Why Rigetti Computing, Inc. (RGTI) Is Skyrocketing - Yahoo Finance Here’s Why Rigetti Computing, Inc. (RGTI) Is Skyrocketing  Yahoo Finance",neutral,0.8340057730674744,0.0
RGTI,Rigetti Computing Inc,2025-01-15,2025-01,google,"Here’s Why Quantum Stocks, Including RGTI and IONQ, Are Surging Today - Yahoo Finance Here’s Why Quantum Stocks, Including RGTI and IONQ, Are Surging Today  Yahoo Finance",neutral,0.8192864060401917,0.0
RGTI,Rigetti Computing Inc,2025-01-15,2025-01,google,The Better Quantum Computing Stock to Buy Now: RGTI or IONQ - Yahoo Finance The Better Quantum Computing Stock to Buy Now: RGTI or IONQ  Yahoo Finance,neutral,0.8538013696670532,0.0
RGTI,Rigetti Computing Inc,2025-01-18,2025-01,google,"Why Did Rigetti Computing, Inc. (RGTI) Go Down on Friday? - Yahoo Finance Why Did Rigetti Computing, Inc. (RGTI) Go Down on Friday?  Yahoo Finance",negative,0.7775107026100159,-0.7775107026100159
RGTI,Rigetti Computing Inc,2025-01-21,2025-01,google,"Investors Heavily Search Rigetti Computing, Inc. (RGTI): Here is What You Need to Know - Yahoo Finance Investors Heavily Search Rigetti Computing, Inc. (RGTI): Here is What You Need to Know  Yahoo Finance",neutral,0.9459161758422852,0.0
RGTI,Rigetti Computing Inc,2025-01-10,2025-01,google,"Why Rigetti Computing Stock Skyrocketed 1,449.4% in 2024 but Is Plummeting in 2025 - Yahoo Finance Why Rigetti Computing Stock Skyrocketed 1,449.4% in 2024 but Is Plummeting in 2025  Yahoo Finance",negative,0.7030674815177917,-0.7030674815177917
RGTI,Rigetti Computing Inc,2025-01-22,2025-01,google,"Here’s Why Jim Cramer Says “Avoid Rigetti Computing, Inc. (RGTI)” Despite Quantum Computing Hype” - Yahoo Finance Here’s Why Jim Cramer Says “Avoid Rigetti Computing, Inc. (RGTI)” Despite Quantum Computing Hype”  Yahoo Finance",neutral,0.8939034342765808,0.0
RGTI,Rigetti Computing Inc,2025-01-31,2025-01,google,Is Rigetti Computing (RGTI) a Buy as Wall Street Analysts Look Optimistic? - Yahoo Finance Is Rigetti Computing (RGTI) a Buy as Wall Street Analysts Look Optimistic?  Yahoo Finance,neutral,0.9141382575035095,0.0
RGTI,Rigetti Computing Inc,2025-02-21,2025-02,google,"Rigetti Computing, Inc. (RGTI): Among the Most Active Stocks to Buy Now - Yahoo Finance Rigetti Computing, Inc. (RGTI): Among the Most Active Stocks to Buy Now  Yahoo Finance",neutral,0.8729094862937927,0.0
RGTI,Rigetti Computing Inc,2025-02-12,2025-02,google,"Should You Buy, Sell or Hold RGTI Stock at Its P/S of 116.46X? - Nasdaq Should You Buy, Sell or Hold RGTI Stock at Its P/S of 116.46X?  Nasdaq",neutral,0.9421499967575073,0.0
RGTI,Rigetti Computing Inc,2025-02-18,2025-02,google,Looking for Exposure to RGTI Stock? Try These Two ETFs - TipRanks Looking for Exposure to RGTI Stock? Try These Two ETFs  TipRanks,neutral,0.9385228157043457,0.0
RGTI,Rigetti Computing Inc,2025-02-18,2025-02,google,Growth or Bubble? Decoding the Rapid Rise of RGTI Stock - StocksToTrade Growth or Bubble? Decoding the Rapid Rise of RGTI Stock  StocksToTrade,neutral,0.8400550484657288,0.0
RGTI,Rigetti Computing Inc,2025-02-18,2025-02,google,Rigetti Computing Stock Faces Heat From Chinese Quantum Startup. Is RGTI A Buy Or Sell? - Barchart.com Rigetti Computing Stock Faces Heat From Chinese Quantum Startup. Is RGTI A Buy Or Sell?  Barchart.com,neutral,0.9088680148124695,0.0
RGTI,Rigetti Computing Inc,2025-02-21,2025-02,google,Rigetti Computing (RGTI) Stock: Market Value Hits $2.2B Despite Revenue Dip - CoinCentral Rigetti Computing (RGTI) Stock: Market Value Hits $2.2B Despite Revenue Dip  CoinCentral,positive,0.7302637100219727,0.7302637100219727
RGTI,Rigetti Computing Inc,2025-02-06,2025-02,google,"Why Quantum Computing Stocks Rigetti Computing, D-Wave Quantum, and Quantum Computing Fell Double Digits in January - The Motley Fool Why Quantum Computing Stocks Rigetti Computing, D-Wave Quantum, and Quantum Computing Fell Double Digits in January  The Motley Fool",negative,0.8544344305992126,-0.8544344305992126
RGTI,Rigetti Computing Inc,2025-02-20,2025-02,google,Quantum Computing Stocks Waver After Microsoft Quantum Chip Rally - Investopedia Quantum Computing Stocks Waver After Microsoft Quantum Chip Rally  Investopedia,neutral,0.6440426707267761,0.0
RGTI,Rigetti Computing Inc,2025-02-12,2025-02,google,"Are Quantum Computing Stocks RGTI, IONQ and QBTS Still Worth Buying in 2025? - 24/7 Wall St. Are Quantum Computing Stocks RGTI, IONQ and QBTS Still Worth Buying in 2025?  24/7 Wall St.",neutral,0.9310540556907654,0.0
RGTI,Rigetti Computing Inc,2025-02-18,2025-02,google,"Rigetti Computing, Inc. (RGTI): Among the Best Robinhood Stocks to Buy Under $20 - Yahoo Finance Rigetti Computing, Inc. (RGTI): Among the Best Robinhood Stocks to Buy Under $20  Yahoo Finance",neutral,0.573606014251709,0.0
RGTI,Rigetti Computing Inc,2025-02-18,2025-02,google,Is Rigetti Computing’s (RGTI) Upside Potential Worth the Wild Ride? - TipRanks Is Rigetti Computing’s (RGTI) Upside Potential Worth the Wild Ride?  TipRanks,neutral,0.9023037552833557,0.0
RGTI,Rigetti Computing Inc,2025-02-17,2025-02,google,Is It Worth Investing in Rigetti Computing (RGTI) Based on Wall Street's Bullish Views? - Nasdaq Is It Worth Investing in Rigetti Computing (RGTI) Based on Wall Street's Bullish Views?  Nasdaq,neutral,0.9105475544929504,0.0
RGTI,Rigetti Computing Inc,2025-02-19,2025-02,google,Rigetti Computing (RGTI) Stock Takes a Hit: Quantum Computing Race Heats Up - CoinCentral Rigetti Computing (RGTI) Stock Takes a Hit: Quantum Computing Race Heats Up  CoinCentral,neutral,0.8710407018661499,0.0
RGTI,Rigetti Computing Inc,2025-02-19,2025-02,google,Why Rigetti Computing (RGTI) Crashed on Tuesday? - Yahoo Finance Why Rigetti Computing (RGTI) Crashed on Tuesday?  Yahoo Finance,neutral,0.514254629611969,0.0
RGTI,Rigetti Computing Inc,2025-02-26,2025-02,google,"Why Rigetti Computing, Inc. (RGTI) Went Down on Tuesday - Yahoo Finance Why Rigetti Computing, Inc. (RGTI) Went Down on Tuesday  Yahoo Finance",negative,0.9214345216751099,-0.9214345216751099
RGTI,Rigetti Computing Inc,2025-02-04,2025-02,google,"Rigetti Computing, Inc. (RGTI) Is a Trending Stock: Facts to Know Before Betting on It - Yahoo Finance Rigetti Computing, Inc. (RGTI) Is a Trending Stock: Facts to Know Before Betting on It  Yahoo Finance",neutral,0.9476197957992554,0.0
RGTI,Rigetti Computing Inc,2025-02-11,2025-02,google,Why Rigetti Computing Inc. (RGTI) Went Down on Monday - Yahoo Finance Why Rigetti Computing Inc. (RGTI) Went Down on Monday  Yahoo Finance,negative,0.9038147926330566,-0.9038147926330566
RGTI,Rigetti Computing Inc,2025-02-20,2025-02,google,"Why Quantum Computing Stocks, Including QBTS and RGTI, Are Climbing for a Second Straight Day - Yahoo Finance Why Quantum Computing Stocks, Including QBTS and RGTI, Are Climbing for a Second Straight Day  Yahoo Finance",positive,0.6842811703681946,0.6842811703681946
RGTI,Rigetti Computing Inc,2025-02-20,2025-02,google,"Rigetti Computing, Inc. (RGTI) is Attracting Investor Attention: Here is What You Should Know - Yahoo Finance Rigetti Computing, Inc. (RGTI) is Attracting Investor Attention: Here is What You Should Know  Yahoo Finance",neutral,0.9276880621910095,0.0
RGTI,Rigetti Computing Inc,2025-02-05,2025-02,google,"Rigetti Computing, Inc. (RGTI) Rises Higher Than Market: Key Facts - Yahoo Finance Rigetti Computing, Inc. (RGTI) Rises Higher Than Market: Key Facts  Yahoo Finance",positive,0.927609384059906,0.927609384059906
RGTI,Rigetti Computing Inc,2025-03-06,2025-03,google,"Quantum Stocks React as Rigetti (RGTI) Rebounds, Outlook Eases Investor Concerns - Yahoo Finance Quantum Stocks React as Rigetti (RGTI) Rebounds, Outlook Eases Investor Concerns  Yahoo Finance",positive,0.6570530533790588,0.6570530533790588
RGTI,Rigetti Computing Inc,2025-03-21,2025-03,google,"Rigetti Computing, Inc. (RGTI) Outpaces Stock Market Gains: What You Should Know - Nasdaq Rigetti Computing, Inc. (RGTI) Outpaces Stock Market Gains: What You Should Know  Nasdaq",neutral,0.7341949343681335,0.0
RGTI,Rigetti Computing Inc,2025-03-05,2025-03,google,Is Rigetti Computing Stock a Buy Now? - The Motley Fool Is Rigetti Computing Stock a Buy Now?  The Motley Fool,neutral,0.9200706481933594,0.0
RGTI,Rigetti Computing Inc,2025-03-07,2025-03,google,RGTI Stock Flying High: Too Late to Buy? - StocksToTrade RGTI Stock Flying High: Too Late to Buy?  StocksToTrade,neutral,0.9135361909866333,0.0
RGTI,Rigetti Computing Inc,2025-03-12,2025-03,google,Why Rigetti Computing Inc. (RGTI) Is Skyrocketing Today? - Yahoo Finance Why Rigetti Computing Inc. (RGTI) Is Skyrocketing Today?  Yahoo Finance,neutral,0.8104476928710938,0.0
RGTI,Rigetti Computing Inc,2025-03-17,2025-03,google,Rigetti Computing (RGTI): One of the Best Quantum Computing Stocks to Buy Right Now? - Yahoo Finance Rigetti Computing (RGTI): One of the Best Quantum Computing Stocks to Buy Right Now?  Yahoo Finance,neutral,0.8767191171646118,0.0
RGTI,Rigetti Computing Inc,2025-03-15,2025-03,google,Why Rigetti Computing Inc. (RGTI) Went Up On Friday? - Yahoo Finance Why Rigetti Computing Inc. (RGTI) Went Up On Friday?  Yahoo Finance,neutral,0.8171663284301758,0.0
RGTI,Rigetti Computing Inc,2025-03-17,2025-03,google,"Rigetti Computing, Inc. (RGTI) Stock Declines While Market Improves: Some Information for Investors - Yahoo Finance Rigetti Computing, Inc. (RGTI) Stock Declines While Market Improves: Some Information for Investors  Yahoo Finance",negative,0.5569161176681519,-0.5569161176681519
RGTI,Rigetti Computing Inc,2025-03-13,2025-03,google,"Is Rigetti Computing, Inc. (RGTI) the Best Multibagger Stock to Buy in 2025? - Yahoo Finance Is Rigetti Computing, Inc. (RGTI) the Best Multibagger Stock to Buy in 2025?  Yahoo Finance",neutral,0.900748610496521,0.0
RGTI,Rigetti Computing Inc,2025-03-08,2025-03,google,"Why Rigetti Computing, Inc. (RGTI) Went Up on Friday - Yahoo Finance Why Rigetti Computing, Inc. (RGTI) Went Up on Friday  Yahoo Finance",neutral,0.6634803414344788,0.0
RGTI,Rigetti Computing Inc,2025-03-12,2025-03,google,"Jim Cramer on Rigetti Computing, Inc. (RGTI): ‘It’s A Battle Between The Longs And The Shorts’ - Yahoo Finance Jim Cramer on Rigetti Computing, Inc. (RGTI): ‘It’s A Battle Between The Longs And The Shorts’  Yahoo Finance",neutral,0.8151932954788208,0.0
RGTI,Rigetti Computing Inc,2025-03-11,2025-03,google,"Why Rigetti Computing, Inc. (RGTI) Crashed on Monday - Yahoo Finance Why Rigetti Computing, Inc. (RGTI) Crashed on Monday  Yahoo Finance",negative,0.8452029228210449,-0.8452029228210449
RGTI,Rigetti Computing Inc,2025-03-19,2025-03,google,Why Rigetti Computing Inc. (RGTI) Went Down On Thursday? - Yahoo Finance Why Rigetti Computing Inc. (RGTI) Went Down On Thursday?  Yahoo Finance,negative,0.8277262449264526,-0.8277262449264526
RGTI,Rigetti Computing Inc,2025-03-18,2025-03,google,"Is Rigetti Computing, Inc. (RGTI) a Pump and Dump Stock Favored by Hedge Funds? - Yahoo Finance Is Rigetti Computing, Inc. (RGTI) a Pump and Dump Stock Favored by Hedge Funds?  Yahoo Finance",neutral,0.9405743479728699,0.0
RGTI,Rigetti Computing Inc,2025-03-15,2025-03,google,Rigetti Computing (NasdaqCM:RGTI) Soars 57% Following US$35M Private Placement Announcement - Yahoo Finance Rigetti Computing (NasdaqCM:RGTI) Soars 57% Following US$35M Private Placement Announcement  Yahoo Finance,positive,0.6082059741020203,0.6082059741020203
RGTI,Rigetti Computing Inc,2025-03-28,2025-03,google,Why Rigetti Computing Inc. (RGTI) Went Down On Thursday? - Yahoo Finance Why Rigetti Computing Inc. (RGTI) Went Down On Thursday?  Yahoo Finance,negative,0.8277262449264526,-0.8277262449264526
RGTI,Rigetti Computing Inc,2025-03-12,2025-03,google,"Rigetti Computing, Inc. (RGTI): A Bear Case Theory - Yahoo Finance Rigetti Computing, Inc. (RGTI): A Bear Case Theory  Yahoo Finance",neutral,0.9436116218566895,0.0
RGTI,Rigetti Computing Inc,2025-03-09,2025-03,google,Rigetti Computing (NasdaqCM:RGTI) Skyrockets 109% Despite US$153 Million Net Loss - Yahoo Finance Rigetti Computing (NasdaqCM:RGTI) Skyrockets 109% Despite US$153 Million Net Loss  Yahoo Finance,negative,0.6949151158332825,-0.6949151158332825
RGTI,Rigetti Computing Inc,2025-03-21,2025-03,google,Brokers Suggest Investing in Rigetti Computing (RGTI): Read This Before Placing a Bet - Yahoo Finance Brokers Suggest Investing in Rigetti Computing (RGTI): Read This Before Placing a Bet  Yahoo Finance,neutral,0.9487196803092957,0.0
RGTI,Rigetti Computing Inc,2025-03-03,2025-03,google,"Rigetti Set to Report Q4 Earnings: Buy, Sell or Hold the Stock? - Yahoo Finance Rigetti Set to Report Q4 Earnings: Buy, Sell or Hold the Stock?  Yahoo Finance",neutral,0.9450600147247314,0.0
RGTI,Rigetti Computing Inc,2025-04-01,2025-04,google,"Rigetti Computing, Inc. (RGTI) Stock Sinks As Market Gains: What You Should Know - Yahoo Finance Rigetti Computing, Inc. (RGTI) Stock Sinks As Market Gains: What You Should Know  Yahoo Finance",neutral,0.6671261191368103,0.0
RGTI,Rigetti Computing Inc,2025-04-10,2025-04,google,RGTI Jumps 15% Post DARPA Quantum Project Win: Time to Buy the Stock? - Zacks Investment Research RGTI Jumps 15% Post DARPA Quantum Project Win: Time to Buy the Stock?  Zacks Investment Research,neutral,0.7906283736228943,0.0
RGTI,Rigetti Computing Inc,2025-04-28,2025-04,google,Here's The Price We'd Buy Rigetti Computing At (NASDAQ:RGTI) - Seeking Alpha Here's The Price We'd Buy Rigetti Computing At (NASDAQ:RGTI)  Seeking Alpha,neutral,0.9378858804702759,0.0
RGTI,Rigetti Computing Inc,2025-04-08,2025-04,google,Why Rigetti Computing Inc. (RGTI) Went Up On Monday? - Yahoo Finance Why Rigetti Computing Inc. (RGTI) Went Up On Monday?  Yahoo Finance,neutral,0.8180966973304749,0.0
RGTI,Rigetti Computing Inc,2025-04-01,2025-04,google,Is Rigetti Computing Inc. (RGTI) the Best Debt-Free IT Stock to Buy Under $10? - Yahoo Finance Is Rigetti Computing Inc. (RGTI) the Best Debt-Free IT Stock to Buy Under $10?  Yahoo Finance,neutral,0.8821014165878296,0.0
RGTI,Rigetti Computing Inc,2025-04-14,2025-04,google,Why Rigetti Computing Inc. (RGTI) Went Down On Monday? - Yahoo Finance Why Rigetti Computing Inc. (RGTI) Went Down On Monday?  Yahoo Finance,negative,0.8091378211975098,-0.8091378211975098
RGTI,Rigetti Computing Inc,2025-04-29,2025-04,google,"Why Rigetti Computing, Inc. (RGTI) is Among the Best Oversold NASDAQ Stocks to Buy Right Now - Yahoo Finance Why Rigetti Computing, Inc. (RGTI) is Among the Best Oversold NASDAQ Stocks to Buy Right Now  Yahoo Finance",neutral,0.9182709455490112,0.0
RGTI,Rigetti Computing Inc,2025-04-12,2025-04,google,Why Rigetti Computing Inc. (RGTI) Went Down On Friday? - Yahoo Finance Why Rigetti Computing Inc. (RGTI) Went Down On Friday?  Yahoo Finance,negative,0.8191311359405518,-0.8191311359405518
