ticker,company,date,month,source,headline,sentiment_label,sentiment_confidence,sentiment_score
RGTI,Rigetti Computing Inc,2025-04-29,2025-04,google,"Investors Heavily Search Rigetti Computing, Inc. (RGTI): Here is What You Need to Know - Yahoo Finance Investors Heavily Search Rigetti Computing, Inc. (RGTI): Here is What You Need to Know  Yahoo Finance",neutral,0.9459161758422852,0.0
RGTI,Rigetti Computing Inc,2025-04-30,2025-04,google,Why Rigetti Computing Inc. (RGTI) Went Down On Tuesday - Yahoo Finance Why Rigetti Computing Inc. (RGTI) Went Down On Tuesday  Yahoo Finance,negative,0.9044412970542908,-0.9044412970542908
RGTI,Rigetti Computing Inc,2025-04-10,2025-04,google,"Rigetti Computing, Inc. (RGTI) Ascends While Market Falls: Some Facts to Note - Yahoo Finance Rigetti Computing, Inc. (RGTI) Ascends While Market Falls: Some Facts to Note  Yahoo Finance",neutral,0.9195454120635986,0.0
RGTI,Rigetti Computing Inc,2025-04-04,2025-04,google,Jim Cramer on Rigetti Computing (RGTI): ‘It’s a Meme Stock’ - Yahoo Finance Jim Cramer on Rigetti Computing (RGTI): ‘It’s a Meme Stock’  Yahoo Finance,neutral,0.9471498727798462,0.0
RGTI,Rigetti Computing Inc,2025-04-25,2025-04,google,"Rigetti Computing, Inc. (RGTI) Outpaces Stock Market Gains: What You Should Know - Yahoo Finance Rigetti Computing, Inc. (RGTI) Outpaces Stock Market Gains: What You Should Know  Yahoo Finance",neutral,0.6086394786834717,0.0
RGTI,Rigetti Computing Inc,2025-04-03,2025-04,google,Why Rigetti Computing Inc. (RGTI) Went Up On Wednesday? - Yahoo Finance Why Rigetti Computing Inc. (RGTI) Went Up On Wednesday?  Yahoo Finance,neutral,0.8210524916648865,0.0
RGTI,Rigetti Computing Inc,2025-04-17,2025-04,google,"Rigetti Computing, Inc. (RGTI) Rises Higher Than Market: Key Facts - Yahoo Finance Rigetti Computing, Inc. (RGTI) Rises Higher Than Market: Key Facts  Yahoo Finance",positive,0.927609384059906,0.927609384059906
RGTI,Rigetti Computing Inc,2025-04-07,2025-04,google,Is Rigetti Computing (RGTI) a Buy as Wall Street Analysts Look Optimistic? - Yahoo Finance Is Rigetti Computing (RGTI) a Buy as Wall Street Analysts Look Optimistic?  Yahoo Finance,neutral,0.9141382575035095,0.0
RGTI,Rigetti Computing Inc,2025-04-07,2025-04,google,"Rigetti Computing, Inc. (RGTI) is Attracting Investor Attention: Here is What You Should Know - Yahoo Finance Rigetti Computing, Inc. (RGTI) is Attracting Investor Attention: Here is What You Should Know  Yahoo Finance",neutral,0.9276880621910095,0.0
RGTI,Rigetti Computing Inc,2025-04-18,2025-04,google,"Here is What to Know Beyond Why Rigetti Computing, Inc. (RGTI) is a Trending Stock - Yahoo Finance Here is What to Know Beyond Why Rigetti Computing, Inc. (RGTI) is a Trending Stock  Yahoo Finance",neutral,0.9391310811042786,0.0
RGTI,Rigetti Computing Inc,2025-04-25,2025-04,google,Rigetti Computing (NasdaqCM:RGTI) Joins DARPA Quantum Benchmarking Initiative - Yahoo Finance Rigetti Computing (NasdaqCM:RGTI) Joins DARPA Quantum Benchmarking Initiative  Yahoo Finance,neutral,0.9338904023170471,0.0
RGTI,Rigetti Computing Inc,2025-04-04,2025-04,google,Rigetti Computing (NasdaqCM:RGTI) Selected For US$1M DARPA Quantum Benchmarking Initiative - Yahoo Finance Rigetti Computing (NasdaqCM:RGTI) Selected For US$1M DARPA Quantum Benchmarking Initiative  Yahoo Finance,positive,0.6175327301025391,0.6175327301025391
RGTI,Rigetti Computing Inc,2025-05-14,2025-05,google,"Why Rigetti Computing, Inc. (RGTI) Skyrocketed On Wednesday - Yahoo Finance Why Rigetti Computing, Inc. (RGTI) Skyrocketed On Wednesday  Yahoo Finance",negative,0.7899922132492065,-0.7899922132492065
RGTI,Rigetti Computing Inc,2025-05-13,2025-05,google,Quantum Computing Stocks: Rigetti Falls On Q1 Revenue Miss - Investor's Business Daily Quantum Computing Stocks: Rigetti Falls On Q1 Revenue Miss  Investor's Business Daily,negative,0.9415832757949829,-0.9415832757949829
RGTI,Rigetti Computing Inc,2025-05-09,2025-05,google,"Should You Buy, Hold, or Sell RGTI Stock Before Q1 Earnings? - Nasdaq Should You Buy, Hold, or Sell RGTI Stock Before Q1 Earnings?  Nasdaq",neutral,0.9251344799995422,0.0
RGTI,Rigetti Computing Inc,2025-05-13,2025-05,google,Here's why Rigetti Computing (RGTI) stock is down despite U.S.-China trade deal - Investorsobserver Here's why Rigetti Computing (RGTI) stock is down despite U.S.-China trade deal  Investorsobserver,negative,0.9289339780807495,-0.9289339780807495
RGTI,Rigetti Computing Inc,2025-05-12,2025-05,google,Rigetti Computing Reports First Quarter 2025 Financial Results - Stock Titan Rigetti Computing Reports First Quarter 2025 Financial Results  Stock Titan,neutral,0.9530948400497437,0.0
RGTI,Rigetti Computing Inc,2025-05-13,2025-05,google,Rigetti Computing Stock Tumbles as Revenue Sinks - Investopedia Rigetti Computing Stock Tumbles as Revenue Sinks  Investopedia,negative,0.9506112337112427,-0.9506112337112427
RGTI,Rigetti Computing Inc,2025-05-22,2025-05,google,"Why Rigetti Computing, Inc. (RGTI) Soared Today - Yahoo Finance Why Rigetti Computing, Inc. (RGTI) Soared Today  Yahoo Finance",positive,0.7718972563743591,0.7718972563743591
RGTI,Rigetti Computing Inc,2025-05-09,2025-05,google,D-Wave Quantum (QBTS) and Rigetti (RGTI) Are Aggressive Growth Stocks - Nasdaq D-Wave Quantum (QBTS) and Rigetti (RGTI) Are Aggressive Growth Stocks  Nasdaq,neutral,0.7835448384284973,0.0
RGTI,Rigetti Computing Inc,2025-05-02,2025-05,google,"Why Rigetti Computing, Inc. (RGTI) Went Up On Friday? - Yahoo Finance Why Rigetti Computing, Inc. (RGTI) Went Up On Friday?  Yahoo Finance",neutral,0.8265616297721863,0.0
RGTI,Rigetti Computing Inc,2025-05-14,2025-05,google,"Why Rigetti Computing, Inc. (RGTI) Declined on Tuesday - Yahoo Finance Why Rigetti Computing, Inc. (RGTI) Declined on Tuesday  Yahoo Finance",neutral,0.5299137830734253,0.0
RGTI,Rigetti Computing Inc,2025-05-19,2025-05,google,"Rigetti Computing, Inc. (RGTI) Is a Trending Stock: Facts to Know Before Betting on It - Yahoo Finance Rigetti Computing, Inc. (RGTI) Is a Trending Stock: Facts to Know Before Betting on It  Yahoo Finance",neutral,0.9476197957992554,0.0
RGTI,Rigetti Computing Inc,2025-05-07,2025-05,google,"Rigetti Computing, Inc. (RGTI): Among Most Popular Stocks on Robinhood in 2025 - Yahoo Finance Rigetti Computing, Inc. (RGTI): Among Most Popular Stocks on Robinhood in 2025  Yahoo Finance",neutral,0.8087656497955322,0.0
RGTI,Rigetti Computing Inc,2025-05-21,2025-05,google,"Why Rigetti Computing, Inc. (RGTI) Crashed Today - Yahoo Finance Why Rigetti Computing, Inc. (RGTI) Crashed Today  Yahoo Finance",neutral,0.548651933670044,0.0
RGTI,Rigetti Computing Inc,2025-05-20,2025-05,google,Rigetti Computing’s (RGTI) Quantum Potential Meets Financial Reality - Yahoo Finance Rigetti Computing’s (RGTI) Quantum Potential Meets Financial Reality  Yahoo Finance,neutral,0.9240203499794006,0.0
RGTI,Rigetti Computing Inc,2025-05-29,2025-05,google,Rigetti Computing (NasdaqCM:RGTI) Reports Turnaround With Strong Quarterly Earnings - Yahoo Finance Rigetti Computing (NasdaqCM:RGTI) Reports Turnaround With Strong Quarterly Earnings  Yahoo Finance,positive,0.9342751502990723,0.9342751502990723
RGTI,Rigetti Computing Inc,2025-05-08,2025-05,google,Is It Worth Investing in Rigetti Computing (RGTI) Based on Wall Street's Bullish Views? - Yahoo Finance Is It Worth Investing in Rigetti Computing (RGTI) Based on Wall Street's Bullish Views?  Yahoo Finance,neutral,0.9253615736961365,0.0
RGTI,Rigetti Computing Inc,2025-05-30,2025-05,google,"Rigetti Computing, Inc. (RGTI) is Attracting Investor Attention: Here is What You Should Know - Yahoo Finance Rigetti Computing, Inc. (RGTI) is Attracting Investor Attention: Here is What You Should Know  Yahoo Finance",neutral,0.9276880621910095,0.0
RGTI,Rigetti Computing Inc,2025-05-27,2025-05,google,Is It Worth Investing in Rigetti Computing (RGTI) Based on Wall Street's Bullish Views? - Yahoo Finance Is It Worth Investing in Rigetti Computing (RGTI) Based on Wall Street's Bullish Views?  Yahoo Finance,neutral,0.9253615736961365,0.0
RGTI,Rigetti Computing Inc,2025-05-03,2025-05,google,Rigetti Computing (NasdaqCM:RGTI) Secures US$5M Air Force Research Grant - Yahoo Finance Rigetti Computing (NasdaqCM:RGTI) Secures US$5M Air Force Research Grant  Yahoo Finance,positive,0.4985789656639099,0.4985789656639099
RGTI,Rigetti Computing Inc,2025-05-27,2025-05,google,Rigetti vs. IBM: Which Quantum Computing Stock Has Better Prospects? - Yahoo Finance Rigetti vs. IBM: Which Quantum Computing Stock Has Better Prospects?  Yahoo Finance,neutral,0.7999798059463501,0.0
RGTI,Rigetti Computing Inc,2025-06-20,2025-06,google,"Rigetti Computing, Inc. (RGTI) Declines More Than Market: Some Information for Investors - Yahoo Finance Rigetti Computing, Inc. (RGTI) Declines More Than Market: Some Information for Investors  Yahoo Finance",negative,0.867957592010498,-0.867957592010498
RGTI,Rigetti Computing Inc,2025-06-04,2025-06,google,"RGTI Stock: What’s Next After An 1,100% Rally? - Forbes RGTI Stock: What’s Next After An 1,100% Rally?  Forbes",neutral,0.9333304762840271,0.0
RGTI,Rigetti Computing Inc,2025-06-17,2025-06,google,Rigetti Computing: Selling More Shares Than Quantum Computers (NASDAQ:RGTI) - Seeking Alpha Rigetti Computing: Selling More Shares Than Quantum Computers (NASDAQ:RGTI)  Seeking Alpha,neutral,0.90706866979599,0.0
RGTI,Rigetti Computing Inc,2025-06-11,2025-06,google,Why Rigetti Computing Stock Is Skyrocketing Today - The Motley Fool Why Rigetti Computing Stock Is Skyrocketing Today  The Motley Fool,neutral,0.8941472768783569,0.0
RGTI,Rigetti Computing Inc,2025-06-24,2025-06,google,Don’t Miss These 2 Small Quantum Stocks Poised to Pop - MarketBeat Don’t Miss These 2 Small Quantum Stocks Poised to Pop  MarketBeat,neutral,0.9310278296470642,0.0
RGTI,Rigetti Computing Inc,2025-06-12,2025-06,google,"Rigetti Computing Stock (RGTI) Continues to Impress After Explosive 1,000% Surge - TipRanks Rigetti Computing Stock (RGTI) Continues to Impress After Explosive 1,000% Surge  TipRanks",positive,0.9473546147346497,0.9473546147346497
RGTI,Rigetti Computing Inc,2025-06-23,2025-06,google,"Rigetti (RGTI) stock cools after 1,100% run, but balance sheet signals more upside - Investorsobserver Rigetti (RGTI) stock cools after 1,100% run, but balance sheet signals more upside  Investorsobserver",neutral,0.3873564302921295,0.0
RGTI,Rigetti Computing Inc,2025-06-24,2025-06,google,$RGTI stock is up 6% today. Here's what we see in our data. - Nasdaq $RGTI stock is up 6% today. Here's what we see in our data.  Nasdaq,positive,0.7586231827735901,0.7586231827735901
RGTI,Rigetti Computing Inc,2025-06-11,2025-06,google,"Quantum Computing Pioneer Rigetti Raises $350M, Sits on $575M War Chest for Expansion - Stock Titan Quantum Computing Pioneer Rigetti Raises $350M, Sits on $575M War Chest for Expansion  Stock Titan",positive,0.7084600925445557,0.7084600925445557
RGTI,Rigetti Computing Inc,2025-06-11,2025-06,google,Rigetti Computing (RGTI) Stock: Can This Quantum Giant Hold Its Ground? - CoinCentral Rigetti Computing (RGTI) Stock: Can This Quantum Giant Hold Its Ground?  CoinCentral,neutral,0.9247454404830933,0.0
RGTI,Rigetti Computing Inc,2025-06-01,2025-06,google,"Why Rigetti Computing, Inc. (RGTI) Crashed Last Week - Insider Monkey Why Rigetti Computing, Inc. (RGTI) Crashed Last Week  Insider Monkey",negative,0.520760178565979,-0.520760178565979
RGTI,Rigetti Computing Inc,2025-06-25,2025-06,google,"Rigetti Computing, Inc. (RGTI) Stock Moves -3.57%: What You Should Know - Yahoo Finance Rigetti Computing, Inc. (RGTI) Stock Moves -3.57%: What You Should Know  Yahoo Finance",neutral,0.9269253611564636,0.0
RGTI,Rigetti Computing Inc,2025-06-23,2025-06,google,"Here is What to Know Beyond Why Rigetti Computing, Inc. (RGTI) is a Trending Stock - Yahoo Finance Here is What to Know Beyond Why Rigetti Computing, Inc. (RGTI) is a Trending Stock  Yahoo Finance",neutral,0.9391310811042786,0.0
RGTI,Rigetti Computing Inc,2025-06-15,2025-06,google,"Rigetti Computing, Inc. (RGTI): I Said “We Ought To Be Looking At Rigetti,” Says Jim Cramer - Yahoo Finance Rigetti Computing, Inc. (RGTI): I Said “We Ought To Be Looking At Rigetti,” Says Jim Cramer  Yahoo Finance",neutral,0.9183443188667297,0.0
RGTI,Rigetti Computing Inc,2025-06-10,2025-06,google,"Is Trending Stock Rigetti Computing, Inc. (RGTI) a Buy Now? - Yahoo Finance Is Trending Stock Rigetti Computing, Inc. (RGTI) a Buy Now?  Yahoo Finance",neutral,0.943566083908081,0.0
RGTI,Rigetti Computing Inc,2025-06-12,2025-06,google,Rigetti Computing (RGTI) Jumps 11% on New $350-Million Fresh Funds - Yahoo Finance Rigetti Computing (RGTI) Jumps 11% on New $350-Million Fresh Funds  Yahoo Finance,positive,0.8737846612930298,0.8737846612930298
RGTI,Rigetti Computing Inc,2025-06-15,2025-06,google,Jim Cramer Says Stocks Like Rigetti Computing Are “Very Much in Style” - Yahoo Finance Jim Cramer Says Stocks Like Rigetti Computing Are “Very Much in Style”  Yahoo Finance,neutral,0.9257047772407532,0.0
RGTI,Rigetti Computing Inc,2025-06-14,2025-06,google,"Why IONQ, RGTI and QBTS are Worth the Risk in Quantum Computing - Yahoo Finance Why IONQ, RGTI and QBTS are Worth the Risk in Quantum Computing  Yahoo Finance",neutral,0.9375296235084534,0.0
RGTI,Rigetti Computing Inc,2025-06-13,2025-06,google,RGTI Trails Quantum Rivals in the Past Month: Time to Hold or Sell? - Yahoo Finance RGTI Trails Quantum Rivals in the Past Month: Time to Hold or Sell?  Yahoo Finance,neutral,0.9147248864173889,0.0
RGTI,Rigetti Computing Inc,2025-06-19,2025-06,google,"Pure-Play Quantum in Focus: IONQ, QBTS Shine, RGTI a Wait-and-See - Yahoo Finance Pure-Play Quantum in Focus: IONQ, QBTS Shine, RGTI a Wait-and-See  Yahoo Finance",neutral,0.952082097530365,0.0
RGTI,Rigetti Computing Inc,2025-07-10,2025-07,google,"Rigetti Computing, Inc. (RGTI) Stock Declines While Market Improves: Some Information for Investors - Yahoo Finance Rigetti Computing, Inc. (RGTI) Stock Declines While Market Improves: Some Information for Investors  Yahoo Finance",negative,0.5569161176681519,-0.5569161176681519
RGTI,Rigetti Computing Inc,2025-07-17,2025-07,google,Rigetti Stock (RGTI) Shoots Up as Top Analyst Sets Street-High Target after Quantum Leap - TipRanks Rigetti Stock (RGTI) Shoots Up as Top Analyst Sets Street-High Target after Quantum Leap  TipRanks,positive,0.9372494220733643,0.9372494220733643
RGTI,Rigetti Computing Inc,2025-07-16,2025-07,google,Why Rigetti Computing Stock Is Skyrocketing Today - The Motley Fool Why Rigetti Computing Stock Is Skyrocketing Today  The Motley Fool,neutral,0.8941472768783569,0.0
RGTI,Rigetti Computing Inc,2025-07-17,2025-07,google,RGTI Stock: Path To 10x Growth - Forbes RGTI Stock: Path To 10x Growth  Forbes,neutral,0.797781765460968,0.0
RGTI,Rigetti Computing Inc,2025-07-03,2025-07,google,Quantum Computing Stocks: Billion-Dollar Groundbreaking Opportunity or Money Sinkhole? - 24/7 Wall St. Quantum Computing Stocks: Billion-Dollar Groundbreaking Opportunity or Money Sinkhole?  24/7 Wall St.,neutral,0.9377995729446411,0.0
RGTI,Rigetti Computing Inc,2025-07-15,2025-07,google,Rigetti Computing: Quantum Cash Pile Changes Everything (NASDAQ:RGTI) - Seeking Alpha Rigetti Computing: Quantum Cash Pile Changes Everything (NASDAQ:RGTI)  Seeking Alpha,neutral,0.934491753578186,0.0
RGTI,Rigetti Computing Inc,2025-07-29,2025-07,google,QUBT or RGTI: Which Quantum Stock Offers the Better Upside Now? - Zacks Investment Research QUBT or RGTI: Which Quantum Stock Offers the Better Upside Now?  Zacks Investment Research,neutral,0.8753533959388733,0.0
RGTI,Rigetti Computing Inc,2025-07-13,2025-07,google,Rigetti (RGTI) Computing Declines 9.4% as Analyst Says “Sell” - Yahoo Finance Rigetti (RGTI) Computing Declines 9.4% as Analyst Says “Sell”  Yahoo Finance,negative,0.9688683152198792,-0.9688683152198792
RGTI,Rigetti Computing Inc,2025-07-16,2025-07,google,Rigetti Stock (RGTI) Explodes after Hitting Key Quantum Milestone - TipRanks Rigetti Stock (RGTI) Explodes after Hitting Key Quantum Milestone  TipRanks,negative,0.4999459981918335,-0.4999459981918335
RGTI,Rigetti Computing Inc,2025-07-02,2025-07,google,Why Rigetti Computing Stock Lit Up Today - The Motley Fool Why Rigetti Computing Stock Lit Up Today  The Motley Fool,neutral,0.907904863357544,0.0
RGTI,Rigetti Computing Inc,2025-07-01,2025-07,google,Rigetti vs. D-Wave: Which Quantum Computing Stock Has Better Prospects? - Zacks Investment Research Rigetti vs. D-Wave: Which Quantum Computing Stock Has Better Prospects?  Zacks Investment Research,neutral,0.7591224312782288,0.0
RGTI,Rigetti Computing Inc,2025-07-04,2025-07,google,D-Wave and Rigetti: Cantor Chooses the Best Quantum Computing Stocks to Buy - Yahoo Finance D-Wave and Rigetti: Cantor Chooses the Best Quantum Computing Stocks to Buy  Yahoo Finance,neutral,0.8854281902313232,0.0
RGTI,Rigetti Computing Inc,2025-07-08,2025-07,google,Is Rigetti Computing the Top Quantum Computing Stock for the Second Half of 2025? - The Motley Fool Is Rigetti Computing the Top Quantum Computing Stock for the Second Half of 2025?  The Motley Fool,neutral,0.915111780166626,0.0
RGTI,Rigetti Computing Inc,2025-07-03,2025-07,google,Rigetti Stock (RGTI) Surges: 3 Reasons This Quantum Play Could Still Have Room to Run - TipRanks Rigetti Stock (RGTI) Surges: 3 Reasons This Quantum Play Could Still Have Room to Run  TipRanks,positive,0.5987821221351624,0.5987821221351624
RGTI,Rigetti Computing Inc,2025-07-21,2025-07,google,Rigetti Just Hit a New Quantum Computing Milestone. Should You Buy RGTI Stock Now? - Yahoo Finance Rigetti Just Hit a New Quantum Computing Milestone. Should You Buy RGTI Stock Now?  Yahoo Finance,neutral,0.8898974061012268,0.0
RGTI,Rigetti Computing Inc,2025-07-01,2025-07,google,"Rigetti Computing, Inc. (RGTI) Registers a Bigger Fall Than the Market: Important Facts to Note - Yahoo Finance Rigetti Computing, Inc. (RGTI) Registers a Bigger Fall Than the Market: Important Facts to Note  Yahoo Finance",negative,0.7551978230476379,-0.7551978230476379
RGTI,Rigetti Computing Inc,2025-07-09,2025-07,google,RGTI: Quantum Breakthroughs Keep Rigetti on Analysts 'Buy' Radar - Yahoo Finance RGTI: Quantum Breakthroughs Keep Rigetti on Analysts 'Buy' Radar  Yahoo Finance,neutral,0.9083964824676514,0.0
RGTI,Rigetti Computing Inc,2025-07-25,2025-07,google,"Is Rigetti the Next NVIDIA, and Should You Buy the Stock? - Yahoo Finance Is Rigetti the Next NVIDIA, and Should You Buy the Stock?  Yahoo Finance",neutral,0.9482315182685852,0.0
RGTI,Rigetti Computing Inc,2025-07-25,2025-07,google,"Rigetti Computing, Inc. (RGTI) Stock Drops Despite Market Gains: Important Facts to Note - Yahoo Finance Rigetti Computing, Inc. (RGTI) Stock Drops Despite Market Gains: Important Facts to Note  Yahoo Finance",negative,0.9100258946418762,-0.9100258946418762
RGTI,Rigetti Computing Inc,2025-07-16,2025-07,google,Rigetti Computing stock price: Why shares took a quantum leap today - Fast Company Rigetti Computing stock price: Why shares took a quantum leap today  Fast Company,neutral,0.9058244228363037,0.0
RGTI,Rigetti Computing Inc,2025-08-01,2025-08,google,1 Quantum Computing Stock to Buy Right Now - AOL.com 1 Quantum Computing Stock to Buy Right Now  AOL.com,neutral,0.936042845249176,0.0
RGTI,Rigetti Computing Inc,2025-08-01,2025-08,google,"Dear Rigetti Computing Stock Fans, Mark Your Calendars for August 15 - Yahoo Finance Dear Rigetti Computing Stock Fans, Mark Your Calendars for August 15  Yahoo Finance",neutral,0.938323974609375,0.0
RGTI,Rigetti Computing Inc,2025-08-01,2025-08,google,"Commit To Buy Rigetti Computing At $7, Earn 18.4% Using Options - Nasdaq Commit To Buy Rigetti Computing At $7, Earn 18.4% Using Options  Nasdaq",neutral,0.9159780740737915,0.0
RGTI,Rigetti Computing Inc,2025-08-01,2025-08,google,"IonQ to Report Q2 Earnings: Buy, Sell or Hold This Quantum Stock Now? - TradingView IonQ to Report Q2 Earnings: Buy, Sell or Hold This Quantum Stock Now?  TradingView",neutral,0.9466808438301086,0.0
RGTI,Rigetti Computing Inc,2025-08-01,2025-08,google,Quantum Stocks Slide: Is the Hype-Fueled Rally Over? - AOL.com Quantum Stocks Slide: Is the Hype-Fueled Rally Over?  AOL.com,neutral,0.8018022179603577,0.0
RGTI,Rigetti Computing Inc,2025-08-01,2025-08,google,Performant Shares Pop on Machinify Deal - Baystreet.ca Performant Shares Pop on Machinify Deal  Baystreet.ca,neutral,0.9308316111564636,0.0
RGTI,Rigetti Computing Inc,2025-08-01,2025-08,google,How GTENU stock performs during market volatility - High Return Idea With Technical Filter - Newser How GTENU stock performs during market volatility - High Return Idea With Technical Filter  Newser,neutral,0.9400564432144165,0.0
ARBE,Arbe Robotics Ltd,2022-01-19,2022-01,google,What Kind Of Investors Own Most Of Arbe Robotics Ltd. (NASDAQ:ARBE)? - Nasdaq What Kind Of Investors Own Most Of Arbe Robotics Ltd. (NASDAQ:ARBE)?  Nasdaq,neutral,0.9531899094581604,0.0
ARBE,Arbe Robotics Ltd,2022-07-18,2022-07,google,"Arbe Introduces Lynx, Industry First Surround Imaging Radar That Enhances Perception and Sensor Fusion - PR Newswire Arbe Introduces Lynx, Industry First Surround Imaging Radar That Enhances Perception and Sensor Fusion  PR Newswire",neutral,0.836061418056488,0.0
ARBE,Arbe Robotics Ltd,2022-07-11,2022-07,google,Arbe's Shareholders Extend their Lock-Up Period - The Globe and Mail Arbe's Shareholders Extend their Lock-Up Period  The Globe and Mail,neutral,0.8529860973358154,0.0
ARBE,Arbe Robotics Ltd,2022-11-23,2022-11,google,13 Best Robotics Stocks To Buy Now - Yahoo Finance 13 Best Robotics Stocks To Buy Now  Yahoo Finance,neutral,0.9364288449287415,0.0
ARBE,Arbe Robotics Ltd,2023-01-14,2023-01,google,"Arbe Robotics Stock: Radars For Autonomous Cars, Cheap Valuation - Seeking Alpha Arbe Robotics Stock: Radars For Autonomous Cars, Cheap Valuation  Seeking Alpha",neutral,0.7820172309875488,0.0
ARBE,Arbe Robotics Ltd,2023-01-10,2023-01,google,"Lidar, Radar, Camera Vendors Fight To Be The Eyes Of Autonomous Vehicles - Investor's Business Daily Lidar, Radar, Camera Vendors Fight To Be The Eyes Of Autonomous Vehicles  Investor's Business Daily",neutral,0.930467963218689,0.0
ARBE,Arbe Robotics Ltd,2023-02-22,2023-02,google,Could Arbe Robotics 4D Radar Lead to Fully Autonomous Driving? - MarketBeat Could Arbe Robotics 4D Radar Lead to Fully Autonomous Driving?  MarketBeat,neutral,0.8788160085678101,0.0
ARBE,Arbe Robotics Ltd,2023-02-22,2023-02,google,Tesla “handpicked” 4D radar! This purest concept stock once surged 70% - 富途牛牛 Tesla “handpicked” 4D radar! This purest concept stock once surged 70%  富途牛牛,neutral,0.6668234467506409,0.0
ARBE,Arbe Robotics Ltd,2023-03-02,2023-03,google,Why Arbe Robotics Shares Plunged 21.6% on Thursday - The Globe and Mail Why Arbe Robotics Shares Plunged 21.6% on Thursday  The Globe and Mail,negative,0.8298921585083008,-0.8298921585083008
ARBE,Arbe Robotics Ltd,2023-04-28,2023-04,google,"Arbe and Weifu Group Announce Strategic Cooperation with DiDi Global's KargoBot, Empowering Safety for L4 Autonomous Trucks - The Globe and Mail Arbe and Weifu Group Announce Strategic Cooperation with DiDi Global's KargoBot, Empowering Safety for L4 Autonomous Trucks  The Globe and Mail",positive,0.7251532673835754,0.7251532673835754
ARBE,Arbe Robotics Ltd,2024-01-25,2024-01,google,Arbe Chipset Empowers HiRain's LRR610 4D Imaging Radar Systems Set for Mass Production by the End of 2024 - PR Newswire Arbe Chipset Empowers HiRain's LRR610 4D Imaging Radar Systems Set for Mass Production by the End of 2024  PR Newswire,neutral,0.8996953368186951,0.0
ARBE,Arbe Robotics Ltd,2024-02-14,2024-02,google,Get Rich Quick With These 7 Robotics Stocks to Buy Now - Nasdaq Get Rich Quick With These 7 Robotics Stocks to Buy Now  Nasdaq,neutral,0.8768947124481201,0.0
ARBE,Arbe Robotics Ltd,2024-03-28,2024-03,google,The Penny Stock A-List: 7 High-Profile Companies on the Verge of Greatness - Yahoo Finance The Penny Stock A-List: 7 High-Profile Companies on the Verge of Greatness  Yahoo Finance,neutral,0.9349979162216187,0.0
ARBE,Arbe Robotics Ltd,2024-03-18,2024-03,google,2 Penny Stocks Worth Adding To Your Watchlist In March 2024 - Barchart.com 2 Penny Stocks Worth Adding To Your Watchlist In March 2024  Barchart.com,neutral,0.9203752279281616,0.0
ARBE,Arbe Robotics Ltd,2024-05-31,2024-05,google,7 Emerging Tech Stocks to Buy for Futuristic Fortunes - Yahoo Finance 7 Emerging Tech Stocks to Buy for Futuristic Fortunes  Yahoo Finance,neutral,0.9153577089309692,0.0
ARBE,Arbe Robotics Ltd,2024-05-29,2024-05,google,Arbe Robotics (NASDAQ:ARBE): They Have the High Definition Radar Self Driving Enabling Chipset - The Wall Street Transcript Arbe Robotics (NASDAQ:ARBE): They Have the High Definition Radar Self Driving Enabling Chipset  The Wall Street Transcript,neutral,0.9173592329025269,0.0
ARBE,Arbe Robotics Ltd,2024-05-17,2024-05,google,This Lidar Stock Is Surging While Tesla Looks To Build Self-Driving Data Center In China - Investor's Business Daily This Lidar Stock Is Surging While Tesla Looks To Build Self-Driving Data Center In China  Investor's Business Daily,neutral,0.8713085055351257,0.0
ARBE,Arbe Robotics Ltd,2024-06-03,2024-06,google,"After falling 86% from its peak, Arbe is coming to Tel Aviv in search of fresh funding - CTech After falling 86% from its peak, Arbe is coming to Tel Aviv in search of fresh funding  CTech",negative,0.9062375426292419,-0.9062375426292419
ARBE,Arbe Robotics Ltd,2024-07-26,2024-07,google,Why Are Hedge Funds Bullish on Arbe Robotics Ltd. (ARBE) Right Now? - Yahoo Finance Why Are Hedge Funds Bullish on Arbe Robotics Ltd. (ARBE) Right Now?  Yahoo Finance,neutral,0.8339312076568604,0.0
ARBE,Arbe Robotics Ltd,2024-07-01,2024-07,google,Arbe Selected by Top OEM for the Development of Imaging Radar for Production - PR Newswire Arbe Selected by Top OEM for the Development of Imaging Radar for Production  PR Newswire,positive,0.5249453783035278,0.5249453783035278
