ticker,company,date,month,source,headline,sentiment_label,sentiment_confidence,sentiment_score
ARBE,Arbe Robotics Ltd,2024-08-12,2024-08,google,ARBE Vs. SERV: Which Robotics Stock Is A Better Bet? - Barchart.com ARBE Vs. SERV: Which Robotics Stock Is A Better Bet?  Barchart.com,neutral,0.8963615894317627,0.0
ARBE,Arbe Robotics Ltd,2024-08-13,2024-08,google,The Top 3 Robotics Stocks to Buy Now: Summer 2024 - InvestorPlace The Top 3 Robotics Stocks to Buy Now: Summer 2024  InvestorPlace,neutral,0.9425098299980164,0.0
ARBE,Arbe Robotics Ltd,2024-08-25,2024-08,google,"Arbe Robotics: Promising Tech, But Speculative Bet Until OEM Contract Materializes - Seeking Alpha Arbe Robotics: Promising Tech, But Speculative Bet Until OEM Contract Materializes  Seeking Alpha",neutral,0.7862234711647034,0.0
ARBE,Arbe Robotics Ltd,2024-09-04,2024-09,google,Arbe Tier-1 Sensrad Announces Signing a Framework Agreement to Provide 4D Imaging Radars to Tianyi Transportation Technology - Yahoo Finance Arbe Tier-1 Sensrad Announces Signing a Framework Agreement to Provide 4D Imaging Radars to Tianyi Transportation Technology  Yahoo Finance,positive,0.897188663482666,0.897188663482666
ARBE,Arbe Robotics Ltd,2024-09-26,2024-09,google,"Arbe's Tier-1 HiRain Develops Radar-Based ADAS System, Replacing LiDAR for Car Automaker - PR Newswire Arbe's Tier-1 HiRain Develops Radar-Based ADAS System, Replacing LiDAR for Car Automaker  PR Newswire",neutral,0.6408526301383972,0.0
ARBE,Arbe Robotics Ltd,2024-09-23,2024-09,google,3 'Strong Buy' Robotics Stocks With 98% or More Upside Potential - Nasdaq 3 'Strong Buy' Robotics Stocks With 98% or More Upside Potential  Nasdaq,neutral,0.4875124394893646,0.0
ARBE,Arbe Robotics Ltd,2024-09-21,2024-09,google,3 'Strong Buy' Robotics Stocks With 98% or More Upside Potential - The Globe and Mail 3 'Strong Buy' Robotics Stocks With 98% or More Upside Potential  The Globe and Mail,neutral,0.8333737254142761,0.0
ARBE,Arbe Robotics Ltd,2024-10-02,2024-10,google,What to watch for during Tesla’s highly anticipated robotaxi reveal - Tech Brew What to watch for during Tesla’s highly anticipated robotaxi reveal  Tech Brew,neutral,0.9478991627693176,0.0
ARBE,Arbe Robotics Ltd,2024-12-30,2024-12,google,2025 Could Be Make-Or-Break For Arbe Robotics’ Radar Technology (ARBE) - Seeking Alpha 2025 Could Be Make-Or-Break For Arbe Robotics’ Radar Technology (ARBE)  Seeking Alpha,neutral,0.9182780981063843,0.0
ARBE,Arbe Robotics Ltd,2025-01-08,2025-01,google,Arbe Robotics Ltd. (ARBE): Among The Companies That Partnered With NVIDIA This Month - Yahoo Finance Arbe Robotics Ltd. (ARBE): Among The Companies That Partnered With NVIDIA This Month  Yahoo Finance,neutral,0.9329968094825745,0.0
ARBE,Arbe Robotics Ltd,2025-01-02,2025-01,google,2025 Could Be A Great Year To Own Arbe Shares - Seeking Alpha 2025 Could Be A Great Year To Own Arbe Shares  Seeking Alpha,neutral,0.8084004521369934,0.0
ARBE,Arbe Robotics Ltd,2025-01-08,2025-01,google,Arbe Robotics launches $29 million stock offering at 15% discount - CTech Arbe Robotics launches $29 million stock offering at 15% discount  CTech,neutral,0.9168795347213745,0.0
ARBE,Arbe Robotics Ltd,2025-01-07,2025-01,google,Arbe Robotics sets price for $29 million share offering - Investing.com Arbe Robotics sets price for $29 million share offering  Investing.com,neutral,0.9437680840492249,0.0
ARBE,Arbe Robotics Ltd,2025-01-13,2025-01,google,Arbe Robotics’ Stock Tumbles: Strategic Offering Sparks Concern - timothysykes.com Arbe Robotics’ Stock Tumbles: Strategic Offering Sparks Concern  timothysykes.com,neutral,0.8088825345039368,0.0
ARBE,Arbe Robotics Ltd,2025-01-06,2025-01,google,Arbe Collaborates with NVIDIA to Enhance Radar-Based Free Space Mapping and AI-Driven Capabilities - PR Newswire Arbe Collaborates with NVIDIA to Enhance Radar-Based Free Space Mapping and AI-Driven Capabilities  PR Newswire,positive,0.7433347702026367,0.7433347702026367
ARBE,Arbe Robotics Ltd,2025-01-06,2025-01,google,This AI Stock Jumped 50% in a Day: Is It the Next SoundHound? - 24/7 Wall St. This AI Stock Jumped 50% in a Day: Is It the Next SoundHound?  24/7 Wall St.,neutral,0.586510181427002,0.0
ARBE,Arbe Robotics Ltd,2025-01-06,2025-01,google,Arbe Robotics Teams with NVIDIA to Revolutionize Automotive Radar Technology for CES 2025 - Stock Titan Arbe Robotics Teams with NVIDIA to Revolutionize Automotive Radar Technology for CES 2025  Stock Titan,neutral,0.6616926193237305,0.0
ARBE,Arbe Robotics Ltd,2025-01-06,2025-01,google,Arbe Robotics Stock Skyrockets Ahead Of CES 2025 Announcement In Collaboration With Nvidia: Retail Extremely Bullish - Stocktwits Arbe Robotics Stock Skyrockets Ahead Of CES 2025 Announcement In Collaboration With Nvidia: Retail Extremely Bullish  Stocktwits,neutral,0.9290244579315186,0.0
ARBE,Arbe Robotics Ltd,2025-01-28,2025-01,google,Arbe Robotics’ Strategic Moves: Stock Implications - StocksToTrade Arbe Robotics’ Strategic Moves: Stock Implications  StocksToTrade,neutral,0.9443588852882385,0.0
ARBE,Arbe Robotics Ltd,2025-01-07,2025-01,google,Arbe (NASDAQ:ARBE) Soars after Teaming Up with Nvidia - TipRanks Arbe (NASDAQ:ARBE) Soars after Teaming Up with Nvidia  TipRanks,positive,0.9332953691482544,0.9332953691482544
ARBE,Arbe Robotics Ltd,2025-01-07,2025-01,google,US Penny Stocks: Arbe Robotics And 2 More Promising Picks - Yahoo Finance US Penny Stocks: Arbe Robotics And 2 More Promising Picks  Yahoo Finance,neutral,0.8293744921684265,0.0
ARBE,Arbe Robotics Ltd,2025-01-10,2025-01,google,The race for the future: What led Nvidia to sign deals with two Israeli companies? - Ynetnews The race for the future: What led Nvidia to sign deals with two Israeli companies?  Ynetnews,neutral,0.8980051279067993,0.0
ARBE,Arbe Robotics Ltd,2025-01-06,2025-01,google,Arbe Robotics stock skyrockets after Nvidia partnership announcement - CTech Arbe Robotics stock skyrockets after Nvidia partnership announcement  CTech,neutral,0.9449025988578796,0.0
ARBE,Arbe Robotics Ltd,2025-01-06,2025-01,google,Arbe Robotics shares soar on NVIDIA collaboration - Investing.com Arbe Robotics shares soar on NVIDIA collaboration  Investing.com,neutral,0.8647323846817017,0.0
ARBE,Arbe Robotics Ltd,2025-01-07,2025-01,google,Arbe Robotics Halts ATM Offering Program Without Share Sales - TipRanks Arbe Robotics Halts ATM Offering Program Without Share Sales  TipRanks,negative,0.7961935997009277,-0.7961935997009277
ARBE,Arbe Robotics Ltd,2025-01-17,2025-01,google,Arbe Robotics Ltd. (ARBE): AI Radar Solutions for Autonomous Vehicles - Yahoo Finance Arbe Robotics Ltd. (ARBE): AI Radar Solutions for Autonomous Vehicles  Yahoo Finance,neutral,0.9368759989738464,0.0
ARBE,Arbe Robotics Ltd,2025-01-06,2025-01,google,Arbe unveils advanced radar tech at CES 2025 - Investing.com Arbe unveils advanced radar tech at CES 2025  Investing.com,neutral,0.9452110528945923,0.0
ARBE,Arbe Robotics Ltd,2025-01-07,2025-01,google,Arbe Robotics Reports Increased Loss and Declining Revenue in Latest Financial Statement - TipRanks Arbe Robotics Reports Increased Loss and Declining Revenue in Latest Financial Statement  TipRanks,negative,0.9694794416427612,-0.9694794416427612
ARBE,Arbe Robotics Ltd,2025-01-06,2025-01,google,"AI Meets Autonomy: Arbe Robotics and NVIDIA Team Up, Driving CES 2025 Buzz - Yahoo Finance AI Meets Autonomy: Arbe Robotics and NVIDIA Team Up, Driving CES 2025 Buzz  Yahoo Finance",neutral,0.8017688989639282,0.0
ARBE,Arbe Robotics Ltd,2025-02-17,2025-02,google,Why Arbe Robotics Ltd. (ARBE) Is Skyrocketing So Far in 2025? - Yahoo Finance Why Arbe Robotics Ltd. (ARBE) Is Skyrocketing So Far in 2025?  Yahoo Finance,neutral,0.8660097718238831,0.0
ARBE,Arbe Robotics Ltd,2025-02-14,2025-02,google,Arbe Robotics Shares Plummet: Analyzing Recent Shifts​ - StocksToTrade Arbe Robotics Shares Plummet: Analyzing Recent Shifts​  StocksToTrade,negative,0.8379716873168945,-0.8379716873168945
ARBE,Arbe Robotics Ltd,2025-02-11,2025-02,google,Arbe Robotics (NASDAQ:ARBE) Trading Down 0.8% - Should You Sell? - MarketBeat Arbe Robotics (NASDAQ:ARBE) Trading Down 0.8% - Should You Sell?  MarketBeat,negative,0.9667514562606812,-0.9667514562606812
ARBE,Arbe Robotics Ltd,2025-02-17,2025-02,google,Why These 15 Software Stocks Are Skyrocketing So Far in 2025 - Insider Monkey Why These 15 Software Stocks Are Skyrocketing So Far in 2025  Insider Monkey,neutral,0.9148120880126953,0.0
ARBE,Arbe Robotics Ltd,2025-02-13,2025-02,google,Arbe to Participate in February Investor Conferences - Yahoo Finance Arbe to Participate in February Investor Conferences  Yahoo Finance,neutral,0.9481255412101746,0.0
ARBE,Arbe Robotics Ltd,2025-02-07,2025-02,google,BYD's intelligent driving has gained hot discussions in the market! How to capitalize on the Asia Vets Industry Chain? These Hong Kong and US stocks may become popular! - 富途牛牛 BYD's intelligent driving has gained hot discussions in the market! How to capitalize on the Asia Vets Industry Chain? These Hong Kong and US stocks may become popular!  富途牛牛,neutral,0.6930273175239563,0.0
ARBE,Arbe Robotics Ltd,2025-03-05,2025-03,google,Arbe Announces Q4 and Full Year 2024 Financial Results - PR Newswire Arbe Announces Q4 and Full Year 2024 Financial Results  PR Newswire,neutral,0.925203800201416,0.0
ARBE,Arbe Robotics Ltd,2025-03-05,2025-03,google,Can Arbe's $70M Cash Infusion Overcome 47% Revenue Drop? OEM Partnerships Signal Future Growth - Stock Titan Can Arbe's $70M Cash Infusion Overcome 47% Revenue Drop? OEM Partnerships Signal Future Growth  Stock Titan,neutral,0.4218059778213501,0.0
ARBE,Arbe Robotics Ltd,2025-03-18,2025-03,google,Arbe Robotics’ Projected Growth Sparks Optimism - StocksToTrade Arbe Robotics’ Projected Growth Sparks Optimism  StocksToTrade,neutral,0.5108166933059692,0.0
ARBE,Arbe Robotics Ltd,2025-03-31,2025-03,google,"Arbe Robotics: Decent Radar Credentials, But Not In Vogue (NASDAQ:ARBE) - Seeking Alpha Arbe Robotics: Decent Radar Credentials, But Not In Vogue (NASDAQ:ARBE)  Seeking Alpha",neutral,0.8098453879356384,0.0
ARBE,Arbe Robotics Ltd,2025-03-18,2025-03,google,ARBE Robotics: Future Growth or Temporary Boost? - timothysykes.com ARBE Robotics: Future Growth or Temporary Boost?  timothysykes.com,neutral,0.8750720024108887,0.0
ARBE,Arbe Robotics Ltd,2025-03-05,2025-03,google,ARBE Stock’s Recent Surge: Time to Buy? - StocksToTrade ARBE Stock’s Recent Surge: Time to Buy?  StocksToTrade,neutral,0.9202552437782288,0.0
ARBE,Arbe Robotics Ltd,2025-03-05,2025-03,google,Is Arbe Robotics Set for a Turnaround? - timothysykes.com Is Arbe Robotics Set for a Turnaround?  timothysykes.com,neutral,0.8958514928817749,0.0
ARBE,Arbe Robotics Ltd,2025-03-10,2025-03,google,10 Tech News Updates Investors Should Not Miss - Insider Monkey 10 Tech News Updates Investors Should Not Miss  Insider Monkey,neutral,0.8526073694229126,0.0
ARBE,Arbe Robotics Ltd,2025-03-22,2025-03,google,10 Penny Stocks With Huge Upside Potential According To Analysts - Insider Monkey 10 Penny Stocks With Huge Upside Potential According To Analysts  Insider Monkey,neutral,0.8861741423606873,0.0
ARBE,Arbe Robotics Ltd,2025-04-24,2025-04,google,ARBE - Arbe Robotics Latest Stock News & Market Updates - Stock Titan ARBE - Arbe Robotics Latest Stock News & Market Updates  Stock Titan,neutral,0.9481662511825562,0.0
ARBE,Arbe Robotics Ltd,2025-04-29,2025-04,google,Arbe Robotics to Discuss Q1 2025 Financial Results in Upcoming Conference Call - TipRanks Arbe Robotics to Discuss Q1 2025 Financial Results in Upcoming Conference Call  TipRanks,neutral,0.9390304684638977,0.0
ARBE,Arbe Robotics Ltd,2025-04-01,2025-04,google,Canaccord Genuity Initiates Coverage of Arbe Robotics (ARBE) with Buy Recommendation - Nasdaq Canaccord Genuity Initiates Coverage of Arbe Robotics (ARBE) with Buy Recommendation  Nasdaq,neutral,0.8718134164810181,0.0
ARBE,Arbe Robotics Ltd,2025-04-29,2025-04,google,Arbe Robotics Sets Date for Q1 2025 Financial Results: What Radar Tech Investors Should Watch - Stock Titan Arbe Robotics Sets Date for Q1 2025 Financial Results: What Radar Tech Investors Should Watch  Stock Titan,neutral,0.9508540034294128,0.0
ARBE,Arbe Robotics Ltd,2025-04-01,2025-04,google,"Aeva, Arbe stocks rise following Canaccord buy rating initiation By Investing.com - Investing.com Canada Aeva, Arbe stocks rise following Canaccord buy rating initiation By Investing.com  Investing.com Canada",positive,0.7198039293289185,0.7198039293289185
ARBE,Arbe Robotics Ltd,2025-04-22,2025-04,google,TVACU IPO News - Industrial tech SPAC Texas Ventures Acquisition III prices $200 million IPO - renaissancecapital.com TVACU IPO News - Industrial tech SPAC Texas Ventures Acquisition III prices $200 million IPO  renaissancecapital.com,neutral,0.9484124183654785,0.0
ARBE,Arbe Robotics Ltd,2025-05-20,2025-05,google,Arbe Announces Q1 2025 Financial Results - PR Newswire Arbe Announces Q1 2025 Financial Results  PR Newswire,neutral,0.9324323534965515,0.0
ARBE,Arbe Robotics Ltd,2025-05-20,2025-05,google,"Arbe Robotics Ltd. (ARBE) Reports Q1 Loss, Misses Revenue Estimates - Nasdaq Arbe Robotics Ltd. (ARBE) Reports Q1 Loss, Misses Revenue Estimates  Nasdaq",negative,0.9641340970993042,-0.9641340970993042
ARBE,Arbe Robotics Ltd,2025-05-20,2025-05,google,"Arbe Robotics earnings beat by $0.03, revenue fell short of estimates - Investing.com Arbe Robotics earnings beat by $0.03, revenue fell short of estimates  Investing.com",negative,0.8167769312858582,-0.8167769312858582
ARBE,Arbe Robotics Ltd,2025-05-20,2025-05,google,Arbe Robotics: A Contrarian Play on Radar Tech’s Growth Potential Amid Near-Term Headwinds - AInvest Arbe Robotics: A Contrarian Play on Radar Tech’s Growth Potential Amid Near-Term Headwinds  AInvest,neutral,0.8831709027290344,0.0
ARBE,Arbe Robotics Ltd,2025-05-20,2025-05,google,Arbe Robotics Ltd. 2025 Q1 - Results - Earnings Call Presentation (NASDAQ:ARBE) - Seeking Alpha Arbe Robotics Ltd. 2025 Q1 - Results - Earnings Call Presentation (NASDAQ:ARBE)  Seeking Alpha,neutral,0.8945623636245728,0.0
ARBE,Arbe Robotics Ltd,2025-05-15,2025-05,google,Gambling.com Group Limited (GAMB) Q1 Earnings and Revenues Surpass Estimates - Yahoo Finance Gambling.com Group Limited (GAMB) Q1 Earnings and Revenues Surpass Estimates  Yahoo Finance,neutral,0.6207786798477173,0.0
ARBE,Arbe Robotics Ltd,2025-05-13,2025-05,google,Arbe Robotics (ARBE) Soars 6.67% on Earnings Anticipation - AInvest Arbe Robotics (ARBE) Soars 6.67% on Earnings Anticipation  AInvest,positive,0.7078352570533752,0.7078352570533752
ARBE,Arbe Robotics Ltd,2025-05-12,2025-05,google,"Blade Air Mobility, Inc. (BLDE) Reports Q1 Loss, Tops Revenue Estimates - Nasdaq Blade Air Mobility, Inc. (BLDE) Reports Q1 Loss, Tops Revenue Estimates  Nasdaq",negative,0.9472630023956299,-0.9472630023956299
ARBE,Arbe Robotics Ltd,2025-05-12,2025-05,google,"Xiaoma Zhixing has nearly quadrupled in just half a month! The autonomous driving Industry has the potential to explode in 2025, which other companies will rise with it? - 富途牛牛 Xiaoma Zhixing has nearly quadrupled in just half a month! The autonomous driving Industry has the potential to explode in 2025, which other companies will rise with it?  富途牛牛",neutral,0.8780567049980164,0.0
ARBE,Arbe Robotics Ltd,2025-06-26,2025-06,google,Arbe Robotics Spikes 20% Amid No News: What's Behind the Volatility? - AInvest Arbe Robotics Spikes 20% Amid No News: What's Behind the Volatility?  AInvest,positive,0.7539282441139221,0.7539282441139221
ARBE,Arbe Robotics Ltd,2025-06-15,2025-06,google,"Arbe Robotics: I See The Vision, But Not The Business (NASDAQ:ARBE) - Seeking Alpha Arbe Robotics: I See The Vision, But Not The Business (NASDAQ:ARBE)  Seeking Alpha",neutral,0.9446762800216675,0.0
ARBE,Arbe Robotics Ltd,2025-06-27,2025-06,google,Are Business Services Stocks Lagging ADEIA INC (ADEA) This Year? - Nasdaq Are Business Services Stocks Lagging ADEIA INC (ADEA) This Year?  Nasdaq,negative,0.6888418197631836,-0.6888418197631836
ARBE,Arbe Robotics Ltd,2025-06-15,2025-06,google,Arbe Robotics: Pioneering 4D Radar's Future Through Strategic Ecosystems - AInvest Arbe Robotics: Pioneering 4D Radar's Future Through Strategic Ecosystems  AInvest,neutral,0.8017898201942444,0.0
ARBE,Arbe Robotics Ltd,2025-06-25,2025-06,google,Pony.ai's Nasdaq Golden Dragon Debut: A Blueprint for Autonomous Driving's Mainstream Adoption - AInvest Pony.ai's Nasdaq Golden Dragon Debut: A Blueprint for Autonomous Driving's Mainstream Adoption  AInvest,neutral,0.8381257653236389,0.0
ARBE,Arbe Robotics Ltd,2025-06-26,2025-06,google,Arbe Robotics Ltd (ARBE) Stock: 52-Week Performance Insights and Trading Volume - investchronicle.com Arbe Robotics Ltd (ARBE) Stock: 52-Week Performance Insights and Trading Volume  investchronicle.com,neutral,0.9458037614822388,0.0
ARBE,Arbe Robotics Ltd,2025-07-09,2025-07,google,"Arbe Robotics Increases Cash Reserves During Q1, What Lies Ahead? - Yahoo Finance Arbe Robotics Increases Cash Reserves During Q1, What Lies Ahead?  Yahoo Finance",positive,0.49958479404449463,0.49958479404449463
ARBE,Arbe Robotics Ltd,2025-07-01,2025-07,google,Arbe Robotics: Driving The Future? (NASDAQ:ARBE) - Seeking Alpha Arbe Robotics: Driving The Future? (NASDAQ:ARBE)  Seeking Alpha,neutral,0.9211088418960571,0.0
ARBE,Arbe Robotics Ltd,2025-07-21,2025-07,google,"Arbe to Announce Second Quarter 2025 Financial Results and to Hold a Conference Call on August 7, 2025 - GlobeNewswire Arbe to Announce Second Quarter 2025 Financial Results and to Hold a Conference Call on August 7, 2025  GlobeNewswire",neutral,0.9455106258392334,0.0
ARBE,Arbe Robotics Ltd,2025-07-20,2025-07,google,"Arbe Robotics Increases Cash Reserves During Q1, What Lies Ahead? - MSN Arbe Robotics Increases Cash Reserves During Q1, What Lies Ahead?  MSN",positive,0.6350533366203308,0.6350533366203308
ARBE,Arbe Robotics Ltd,2025-07-29,2025-07,google,Arbe Expands Beyond Auto: Major US Defense Contract Powers New Radar Systems - Stock Titan Arbe Expands Beyond Auto: Major US Defense Contract Powers New Radar Systems  Stock Titan,neutral,0.5365354418754578,0.0
ARBE,Arbe Robotics Ltd,2025-07-31,2025-07,google,Arbe Robotics (ARBE) Projected to Post Earnings on Thursday - MarketBeat Arbe Robotics (ARBE) Projected to Post Earnings on Thursday  MarketBeat,neutral,0.8842329978942871,0.0
ARBE,Arbe Robotics Ltd,2025-07-28,2025-07,google,Why is ARBE stock attracting strong analyst attention - Pre Market Forecasts Backed By Experts - jammulinksnews.com Why is ARBE stock attracting strong analyst attention - Pre Market Forecasts Backed By Experts  jammulinksnews.com,neutral,0.8926401138305664,0.0
ARBE,Arbe Robotics Ltd,2025-07-01,2025-07,google,Arbe Robotics: Mastering the Radar Race in the Autonomous Driving Era - AInvest Arbe Robotics: Mastering the Radar Race in the Autonomous Driving Era  AInvest,neutral,0.9170171618461609,0.0
ARBE,Arbe Robotics Ltd,2025-07-21,2025-07,google,Arbe Robotics to Discuss Q2 2025 Financial Results on August 7 - TipRanks Arbe Robotics to Discuss Q2 2025 Financial Results on August 7  TipRanks,neutral,0.9333522915840149,0.0
ARBE,Arbe Robotics Ltd,2025-07-21,2025-07,google,Arbe Robotics Sets Q2 2025 Earnings Date: Perception Radar Leader to Report Pre-Market August 7 - Stock Titan Arbe Robotics Sets Q2 2025 Earnings Date: Perception Radar Leader to Report Pre-Market August 7  Stock Titan,neutral,0.9134477376937866,0.0
ARBE,Arbe Robotics Ltd,2025-07-28,2025-07,google,Why is Arbe Robotics Ltd. Equity Warrant stock attracting strong analyst attention - Achieve rapid financial growth with expert help - jammulinksnews.com Why is Arbe Robotics Ltd. Equity Warrant stock attracting strong analyst attention - Achieve rapid financial growth with expert help  jammulinksnews.com,neutral,0.6546529531478882,0.0
ARBE,Arbe Robotics Ltd,2025-07-09,2025-07,google,10 Best Small Cap Robotics Stocks to Buy Now - Insider Monkey 10 Best Small Cap Robotics Stocks to Buy Now  Insider Monkey,neutral,0.889309823513031,0.0
ARBE,Arbe Robotics Ltd,2025-07-21,2025-07,google,"ARBE SEC Filings - Arbe Robotics 10-K, 10-Q, 8-K Forms - Stock Titan ARBE SEC Filings - Arbe Robotics 10-K, 10-Q, 8-K Forms  Stock Titan",neutral,0.9490693807601929,0.0
ARBE,Arbe Robotics Ltd,2025-07-28,2025-07,google,What are analysts’ price targets for Arbe Robotics Ltd. in the next 12 months - Market Forecast Target Finder For 2025 - jammulinksnews.com What are analysts’ price targets for Arbe Robotics Ltd. in the next 12 months - Market Forecast Target Finder For 2025  jammulinksnews.com,neutral,0.9393752813339233,0.0
ARBE,Arbe Robotics Ltd,2025-07-31,2025-07,google,What institutional investors are buying Arbe Robotics Ltd. stock - Best Dividend Forecasts To Watch Now - jammulinksnews.com What institutional investors are buying Arbe Robotics Ltd. stock - Best Dividend Forecasts To Watch Now  jammulinksnews.com,neutral,0.9337886571884155,0.0
ARBE,Arbe Robotics Ltd,2025-07-28,2025-07,google,What catalysts could drive Arbe Robotics Ltd. Equity Warrant stock higher in 2025 - Achieve fast wealth growth with smart picks - jammulinksnews.com What catalysts could drive Arbe Robotics Ltd. Equity Warrant stock higher in 2025 - Achieve fast wealth growth with smart picks  jammulinksnews.com,positive,0.681328296661377,0.681328296661377
ARBE,Arbe Robotics Ltd,2025-07-31,2025-07,google,When is Arbe Robotics Ltd. stock expected to show significant growth - Low Risk Watchlist That Work - jammulinksnews.com When is Arbe Robotics Ltd. stock expected to show significant growth - Low Risk Watchlist That Work  jammulinksnews.com,neutral,0.8946117758750916,0.0
ARBE,Arbe Robotics Ltd,2025-07-28,2025-07,google,Should I hold or sell ARBE stock in 2025 - Capitalize on trading strategies that deliver - jammulinksnews.com Should I hold or sell ARBE stock in 2025 - Capitalize on trading strategies that deliver  jammulinksnews.com,neutral,0.9423892498016357,0.0
ARBE,Arbe Robotics Ltd,2025-07-28,2025-07,google,What are analysts’ price targets for Arbe Robotics Ltd. Equity Warrant in the next 12 months - Strong return on assets - jammulinksnews.com What are analysts’ price targets for Arbe Robotics Ltd. Equity Warrant in the next 12 months - Strong return on assets  jammulinksnews.com,neutral,0.9343441128730774,0.0
ARBE,Arbe Robotics Ltd,2025-07-28,2025-07,google,Why ARBE stock attracts strong analyst attention - High Win Rate Trading Opportunities Detected - beatles.ru Why ARBE stock attracts strong analyst attention - High Win Rate Trading Opportunities Detected  beatles.ru,neutral,0.7393923997879028,0.0
ARBE,Arbe Robotics Ltd,2025-08-01,2025-08,google,What is the dividend policy of ARBE stock - Top Growth Entry Points For Every Investor - jammulinksnews.com What is the dividend policy of ARBE stock - Top Growth Entry Points For Every Investor  jammulinksnews.com,neutral,0.9462220072746277,0.0
ARBE,Arbe Robotics Ltd,2025-08-01,2025-08,google,How does Arbe Robotics Ltd. generate profit in a changing economy - Earnings Report Outlook For 2025 - jammulinksnews.com How does Arbe Robotics Ltd. generate profit in a changing economy - Earnings Report Outlook For 2025  jammulinksnews.com,neutral,0.9319034218788147,0.0
ARBE,Arbe Robotics Ltd,2025-08-01,2025-08,google,How does Arbe Robotics Ltd. compare to its industry peers - Breakout Stocks Tracker With High Returns - jammulinksnews.com How does Arbe Robotics Ltd. compare to its industry peers - Breakout Stocks Tracker With High Returns  jammulinksnews.com,neutral,0.8557392954826355,0.0
ARBE,Arbe Robotics Ltd,2025-08-01,2025-08,google,What are the latest earnings results for Arbe Robotics Ltd. - Entry Signal Growth Plan That Work - jammulinksnews.com What are the latest earnings results for Arbe Robotics Ltd. - Entry Signal Growth Plan That Work  jammulinksnews.com,neutral,0.9359110593795776,0.0
ARBE,Arbe Robotics Ltd,2025-08-01,2025-08,google,Is DLocal Limited a growth stock or a value stock - Expert Picks Target Finder For Consistent Profits - jammulinksnews.com Is DLocal Limited a growth stock or a value stock - Expert Picks Target Finder For Consistent Profits  jammulinksnews.com,neutral,0.9412863254547119,0.0
RGTI,Rigetti Computing Inc,2025-07-18,2025-07,reddit,Rgti call option success 200% n counting Got lucky with RGTI trade.,positive,0.8521770238876343,0.8521770238876343
RGTI,Rigetti Computing Inc,2025-07-15,2025-07,reddit,"70k bet against Quantum computing Jensen literally said they were more ""instrument"" than ""computer"" and proceeded to laugh to their face for 2 hours. Not a single institution holds the stock other than for market making purposes, only monkeys with a robinhood account. Easiest money I'll ever make. Bookmark this post.

https://preview.redd.it/k5t6qyw76ycf1.png?width=1376&format=png&auto=webp&s=12305c60bbed573ad13af6f445b7dd903f3c00d9

",neutral,0.9354382753372192,0.0
RGTI,Rigetti Computing Inc,2025-01-03,2025-01,reddit,"RGTI management sold at $2 giving us the shortest short thesis you will ever read Management diluted at $2 in late November.

The market did not care, and pumped it to $20 for no reason other than mass mania/hysteria.

Management will most likely dilute again, but not much above $2, unless it does an at-the-money death spiral offering which will cause the funding institution to short the stock.

Speaking of management, a lot of them sold their stock as soon as it ran up in November, starting at $1.3 and wit",neutral,0.5179035067558289,0.0
RGTI,Rigetti Computing Inc,2025-01-11,2025-01,reddit,How can I make my money back with these 7k left? It only took,neutral,0.8995525240898132,0.0
