ticker,company,date,month,source,headline,sentiment_label,sentiment_confidence,sentiment_score
RGTI,Rigetti Computing Inc,2025-08-01,2025-08,yahoo,"Dear Rigetti Computing Stock Fans, Mark Your Calendars for August 15 Rigetti is preparing to take a major leap in its quantum computing journey this month.",neutral,0.6797745227813721,0.0
RGTI,Rigetti Computing Inc,2025-07-31,2025-07,yahoo,"Rigetti Computing, Inc. (RGTI) Ascends While Market Falls: Some Facts to Note In the most recent trading session, Rigetti Computing, Inc. (RGTI) closed at $14.5, indicating a +2.29% shift from the previous trading day.",positive,0.7336975336074829,0.7336975336074829
RGTI,Rigetti Computing Inc,2025-07-31,2025-07,yahoo,Why Rigetti Computing Stock Is Soaring Today Rigetti Computing shares jumped after Microsoft signaled quantum computing as the next leap in cloud technology.,positive,0.9337294697761536,0.9337294697761536
RGTI,Rigetti Computing Inc,2025-07-31,2025-07,yahoo,"Quantum Computing Stocks Rally As Microsoft CEO Hails Tech As 'Next Big Accelerator' Quantum computing stocks such as IonQ and D-Wave rose as Microsoft CEO Satya Nadella said, ""The next big accelerator in cloud will be quantum.""",positive,0.6068961024284363,0.6068961024284363
RGTI,Rigetti Computing Inc,2025-07-31,2025-07,yahoo,"Dow Jones Futures Rise As Microsoft, Meta Soar On Earnings After Fed's Powell Hits Rate-Cut Hopes Fed chief Jerome Powell dented hopes for a Sept. rate cut. Microsoft and Meta soared late on earnings.",negative,0.5013403296470642,-0.5013403296470642
RGTI,Rigetti Computing Inc,2025-07-30,2025-07,yahoo,"Better Quantum Computing Stock: Rigetti Computing vs. D-Wave Quantum Rigetti and D-Wave's stock prices have soared more than 1,000% in the past year, but only one looks like a promising investment right now.",positive,0.8188180327415466,0.8188180327415466
RGTI,Rigetti Computing Inc,2025-07-29,2025-07,yahoo,"QUBT or RGTI: Which Quantum Stock Offers the Better Upside Now? QUBT and RGTI are racing toward quantum profits- but only one boasts real revenues, a clear roadmap and major government backing.",positive,0.6366807818412781,0.6366807818412781
RGTI,Rigetti Computing Inc,2025-07-29,2025-07,yahoo,Rigetti vs. Quantum Computing: Which Quantum Stock Is a Smarter Bet? Can RGTI's modular quantum systems outpace QUBT's room-temperature photonic chips in the race for market adoption?,neutral,0.5147733092308044,0.0
RGTI,Rigetti Computing Inc,2025-07-29,2025-07,yahoo,"Rosenblatt Securities Initiates Quantum Computing Stocks IonQ, D-Wave At Buy Rosenblatt Securities initiated coverage on two quantum computing stocks, IonQ and D-Wave with buy ratings ahead of their second-quarter earnings reports.",neutral,0.7622566819190979,0.0
RGTI,Rigetti Computing Inc,2025-07-28,2025-07,yahoo,"Quantum Computing Stocks Gear Up for Q2 Earnings: Chasing Growth, Fighting Losses Second quarter earnings are due for quantum computing stocks starting in early August as investors eye revenue growth amid losses.",positive,0.6746312379837036,0.6746312379837036
ARBE,Arbe Robotics Ltd,2025-07-10,2025-07,yahoo,"Arbe Robotics Increases Cash Reserves During Q1, What Lies Ahead? Arbe Robotics Ltd. (NASDAQ:ARBE) is one of the 10 Best Small Cap Robotics Stocks to Buy Now. On May 20, the company published financial results for Q1 FY2025, posting revenue of $40,000. Arbe Robotics’ cash reserves soared to $71.9 million after the company raised $54.5 million through an offering and escrow release. Of this, $33 […]",positive,0.9448317885398865,0.9448317885398865
ARBE,Arbe Robotics Ltd,2025-06-27,2025-06,yahoo,Are Business Services Stocks Lagging  ADEIA INC (ADEA) This Year? Here is how Adeia (ADEA) and Arbe Robotics Ltd. (ARBE) have performed compared to their sector so far this year.,negative,0.873153567314148,-0.873153567314148
ARBE,Arbe Robotics Ltd,2025-05-25,2025-05,yahoo,"Arbe Robotics First Quarter 2025 Earnings: EPS Beats Expectations, Revenues Lag Arbe Robotics ( NASDAQ:ARBE ) First Quarter 2025 Results Key Financial Results Net loss: US$13.8m (loss widened by 7.9...",negative,0.906105637550354,-0.906105637550354
ARBE,Arbe Robotics Ltd,2025-04-03,2025-04,yahoo,"Arbe Robotics (NasdaqCM:ARBE) Reports Earnings Decline US$0.1M Sales Rise In Losses As Stock Drops 12% In A Week Arbe Robotics (NasdaqCM:ARBE) recently reported significant declines in its earnings, with fourth-quarter sales dropping to $0.1 million from $0.3 million the previous year, and a net loss increasing to $12 million. The company's losses per share rose to $0.15 from $0.12, reflecting ongoing challenges. Concurrently, the broader market faced volatility due to new tariffs announced by President Trump, which led to a sharp decline across multiple indices, including the Nasdaq, which fell 4.7%...",negative,0.9751366376876831,-0.9751366376876831
ARBE,Arbe Robotics Ltd,2025-03-07,2025-03,yahoo,"Arbe Robotics Full Year 2024 Earnings: EPS Beats Expectations, Revenues Lag Arbe Robotics ( NASDAQ:ARBE ) Full Year 2024 Results Key Financial Results Net loss: US$49.3m (loss widened by 13% from...",negative,0.5719611644744873,-0.5719611644744873
ARBE,Arbe Robotics Ltd,2025-03-06,2025-03,yahoo,"Arbe Robotics price target lowered to $3 from $5 at Roth MKM Roth MKM analyst Suji Desilva lowered the firm’s price target on Arbe Robotics (ARBE) to $3 from $5 and keeps a Buy rating on the shares. Reflecting delayed automotive platform decisions, Arbe guided to a muted 2025 revenue outlook with the opportunity to ramp late in the year in some non-auto programs, the firm says. The company guided for a similar EBITDA loss for 2025 on a year-over-year basis. With the recent funding, Roth believes the company is funded to execute its operating plan. Publish",negative,0.8512150049209595,-0.8512150049209595
ARBE,Arbe Robotics Ltd,2025-03-03,2025-03,yahoo,"Arbe Robotics (NasdaqCM:ARBE) Partners With NVIDIA In AI Collaboration (Stock Moves 10%) Arbe Robotics (NasdaqCM:ARBE) recently announced a significant collaboration with NVIDIA, enhancing AI-driven capabilities in the automotive industry, a move likely contributing to the company's stock price increase of around 10% over the past quarter. This collaboration highlights advancements in radar technology that underscore the firm's innovative trajectory. Conversely, general market trends in the recent quarter presented challenges, with drops observed in major indexes like the Nasdaq...",positive,0.9513052701950073,0.9513052701950073
ARBE,Arbe Robotics Ltd,2025-02-11,2025-02,yahoo,"US Growth Stocks With Insider Ownership As High As 25% In the wake of recent market fluctuations spurred by President Trump's imposition of tariffs on steel and aluminum imports, U.S. investors are closely monitoring the impact on major indices like the Dow Jones, Nasdaq Composite, and S&P 500. Amidst this backdrop, growth companies with substantial insider ownership can offer a unique perspective on potential resilience and alignment of interests between management and shareholders.",neutral,0.7939568161964417,0.0
ARBE,Arbe Robotics Ltd,2025-01-10,2025-01,yahoo,"Exploring High Growth Tech Stocks In January 2025 The United States market has remained flat over the past week but has shown a robust 23% increase over the past year, with earnings projected to grow by 15% annually. In this environment, identifying high growth tech stocks involves looking for companies that demonstrate strong innovation and adaptability to capitalize on these favorable conditions.",positive,0.9410171508789062,0.9410171508789062
ARBE,Arbe Robotics Ltd,2025-01-08,2025-01,yahoo,"US Growth Companies With High Insider Ownership For January 2025 As the U.S. stock market navigates through mixed signals from recent labor market data and fluctuating interest rate expectations, investors are closely monitoring growth companies with strong insider ownership for potential opportunities. In such a volatile environment, stocks with high insider ownership can be appealing as they often indicate confidence from those who know the company best, aligning management interests with shareholders.",neutral,0.6285784244537354,0.0
RGTI,Rigetti Computing Inc,2021-10-07,2021-10,google,SPAC news: Quantum startup Rigetti Computing to go public; IX Acquisition looks for $200m - Data Center Dynamics SPAC news: Quantum startup Rigetti Computing to go public; IX Acquisition looks for $200m  Data Center Dynamics,neutral,0.8683686852455139,0.0
RGTI,Rigetti Computing Inc,2021-10-06,2021-10,google,Rigetti Computing goes public via SPAC merger - TechCrunch Rigetti Computing goes public via SPAC merger  TechCrunch,neutral,0.9393396377563477,0.0
RGTI,Rigetti Computing Inc,2021-10-06,2021-10,google,Quantum hardware startup Rigetti Computing to go public in $1.5B SPAC deal with ex-Zillow CEO - GeekWire Quantum hardware startup Rigetti Computing to go public in $1.5B SPAC deal with ex-Zillow CEO  GeekWire,neutral,0.6031625270843506,0.0
RGTI,Rigetti Computing Inc,2022-03-05,2022-03,google,Rigetti Computing (RGTI) - Zacks Investment Research Rigetti Computing (RGTI)  Zacks Investment Research,neutral,0.9420977830886841,0.0
RGTI,Rigetti Computing Inc,2022-03-02,2022-03,google,"Rigetti Computing Announces Closing of Business Combination with Supernova Partners Acquisition Company II, Ltd.; Begins Trading on Nasdaq Capital Market Today - Yahoo Finance Rigetti Computing Announces Closing of Business Combination with Supernova Partners Acquisition Company II, Ltd.; Begins Trading on Nasdaq Capital Market Today  Yahoo Finance",neutral,0.9009493589401245,0.0
RGTI,Rigetti Computing Inc,2022-03-02,2022-03,google,"Rigetti SPAC deal closes, quantum computing company debuts on Nasdaq - Data Center Dynamics Rigetti SPAC deal closes, quantum computing company debuts on Nasdaq  Data Center Dynamics",neutral,0.8340811729431152,0.0
RGTI,Rigetti Computing Inc,2022-03-02,2022-03,google,"The Funded: Rigetti Computing goes public, but with about $200 million less than expected - The Business Journals The Funded: Rigetti Computing goes public, but with about $200 million less than expected  The Business Journals",neutral,0.9027187824249268,0.0
RGTI,Rigetti Computing Inc,2022-04-18,2022-04,google,How to Invest in Quantum Computing [+24 Stocks in 2024] - The Quantum Insider How to Invest in Quantum Computing [+24 Stocks in 2024]  The Quantum Insider,neutral,0.9436922669410706,0.0
RGTI,Rigetti Computing Inc,2022-09-16,2022-09,google,Rigetti (RGTI) Stock Pops on New Quantum Computing Partners - InvestorPlace Rigetti (RGTI) Stock Pops on New Quantum Computing Partners  InvestorPlace,neutral,0.9380457401275635,0.0
RGTI,Rigetti Computing Inc,2022-09-20,2022-09,google,Prediction: These Growth Stocks Will Be Worth $10 Billion by 2030 - The Motley Fool Prediction: These Growth Stocks Will Be Worth $10 Billion by 2030  The Motley Fool,neutral,0.9300910234451294,0.0
RGTI,Rigetti Computing Inc,2023-01-30,2023-01,google,"What happens to Rigetti (RGTI) now that its founder, Chad Rigetti, has left the Quantum Company? Will it Thrive or even Survive? - Quantum Zeitgeist What happens to Rigetti (RGTI) now that its founder, Chad Rigetti, has left the Quantum Company? Will it Thrive or even Survive?  Quantum Zeitgeist",neutral,0.8806850910186768,0.0
RGTI,Rigetti Computing Inc,2023-02-03,2023-02,google,Quantum Computing Firm Rigetti Faces Delisting - HPCwire Quantum Computing Firm Rigetti Faces Delisting  HPCwire,neutral,0.5283980965614319,0.0
RGTI,Rigetti Computing Inc,2023-03-22,2023-03,google,"7 Hot Stocks To Turn $1,000 Into $10,000 By 2030 - Yahoo Finance 7 Hot Stocks To Turn $1,000 Into $10,000 By 2030  Yahoo Finance",neutral,0.8892937898635864,0.0
RGTI,Rigetti Computing Inc,2023-04-25,2023-04,google,15 Small Company Stocks You Should Own According to Hedge Funds - Yahoo Finance 15 Small Company Stocks You Should Own According to Hedge Funds  Yahoo Finance,neutral,0.9478915333747864,0.0
RGTI,Rigetti Computing Inc,2023-05-23,2023-05,google,3 Quantum Computing Stocks to Make You the Millionaire Next Door - Yahoo Finance 3 Quantum Computing Stocks to Make You the Millionaire Next Door  Yahoo Finance,neutral,0.939049482345581,0.0
RGTI,Rigetti Computing Inc,2023-06-14,2023-06,google,Rigetti Computing: Accelerated Roadmap And Potential Synergy With Generative AI - Seeking Alpha Rigetti Computing: Accelerated Roadmap And Potential Synergy With Generative AI  Seeking Alpha,neutral,0.7852212190628052,0.0
RGTI,Rigetti Computing Inc,2023-07-28,2023-07,google,10 Top Quantum Computing Stocks and ETFs to Invest In - FinMasters 10 Top Quantum Computing Stocks and ETFs to Invest In  FinMasters,neutral,0.9244427680969238,0.0
RGTI,Rigetti Computing Inc,2023-08-15,2023-08,google,Rigetti: A Quantum Computing Company to Monitor - Yahoo Finance Rigetti: A Quantum Computing Company to Monitor  Yahoo Finance,neutral,0.9544839262962341,0.0
RGTI,Rigetti Computing Inc,2023-08-14,2023-08,google,Rigetti Computing (NASDAQ: RGTI) Delivers Strong Q2 Results - TipRanks Rigetti Computing (NASDAQ: RGTI) Delivers Strong Q2 Results  TipRanks,positive,0.9504802823066711,0.9504802823066711
RGTI,Rigetti Computing Inc,2023-08-10,2023-08,google,How To Invest In Tech Stocks: What You Need To Know in July 2025 - Forbes How To Invest In Tech Stocks: What You Need To Know in July 2025  Forbes,neutral,0.941267728805542,0.0
RGTI,Rigetti Computing Inc,2023-09-30,2023-09,google,17 Quantum Stocks Updated With Eagerly Awaited Zapata AI For 2024 - Quantum Zeitgeist 17 Quantum Stocks Updated With Eagerly Awaited Zapata AI For 2024  Quantum Zeitgeist,neutral,0.9361950159072876,0.0
RGTI,Rigetti Computing Inc,2023-09-01,2023-09,google,3 Quantum Computing Stocks to Buy to Turn $1000 Into $1 Million - Yahoo Finance 3 Quantum Computing Stocks to Buy to Turn $1000 Into $1 Million  Yahoo Finance,neutral,0.8951346278190613,0.0
RGTI,Rigetti Computing Inc,2023-09-08,2023-09,google,Rigetti Computing: Quantum Advantage Remains Elusive (NASDAQ:RGTI) - Seeking Alpha Rigetti Computing: Quantum Advantage Remains Elusive (NASDAQ:RGTI)  Seeking Alpha,neutral,0.9299123287200928,0.0
RGTI,Rigetti Computing Inc,2023-09-11,2023-09,google,EMCORE Introduces New TAC-440 MEMS Inertial Measurement Unit - Stock Titan EMCORE Introduces New TAC-440 MEMS Inertial Measurement Unit  Stock Titan,neutral,0.8421565890312195,0.0
RGTI,Rigetti Computing Inc,2023-09-20,2023-09,google,"4 Pure Play Quantum Computing Shares, With One More Coming Soon - Quantum Zeitgeist 4 Pure Play Quantum Computing Shares, With One More Coming Soon  Quantum Zeitgeist",neutral,0.940274715423584,0.0
RGTI,Rigetti Computing Inc,2023-09-06,2023-09,google,How to buy RGTI stock? | Invest in Rigetti Computing Inc. - Finbold How to buy RGTI stock? | Invest in Rigetti Computing Inc.  Finbold,neutral,0.9449790120124817,0.0
RGTI,Rigetti Computing Inc,2023-09-04,2023-09,google,Top 3 Quantum Computing Penny Stocks to Buy - Finbold Top 3 Quantum Computing Penny Stocks to Buy  Finbold,neutral,0.9293133020401001,0.0
RGTI,Rigetti Computing Inc,2023-10-24,2023-10,google,Quantum Pioneer D-Wave Again Faces NYSE Delisting - HPCwire Quantum Pioneer D-Wave Again Faces NYSE Delisting  HPCwire,neutral,0.6514320373535156,0.0
RGTI,Rigetti Computing Inc,2023-10-09,2023-10,google,Fulton Financial Corporation Announces Dates for Third Quarter 2023 Earnings Release and Webcast - Stock Titan Fulton Financial Corporation Announces Dates for Third Quarter 2023 Earnings Release and Webcast  Stock Titan,neutral,0.9381417036056519,0.0
RGTI,Rigetti Computing Inc,2023-11-30,2023-11,google,"If You Can Only Buy One Quantum Computing Stock in December, It Better Be One of These 3 Names - Nasdaq If You Can Only Buy One Quantum Computing Stock in December, It Better Be One of These 3 Names  Nasdaq",neutral,0.9400129914283752,0.0
RGTI,Rigetti Computing Inc,2023-12-06,2023-12,google,"Rigetti Launches the Novera QPU, the Company’s First Commercially Available QPU - GlobeNewswire Rigetti Launches the Novera QPU, the Company’s First Commercially Available QPU  GlobeNewswire",neutral,0.8886486887931824,0.0
RGTI,Rigetti Computing Inc,2024-01-25,2024-01,google,The Next Big Thing: 3 Stocks Leading in Quantum Computing - Yahoo Finance The Next Big Thing: 3 Stocks Leading in Quantum Computing  Yahoo Finance,neutral,0.8795243501663208,0.0
RGTI,Rigetti Computing Inc,2024-01-30,2024-01,google,"After Artificial Intelligence, Quantum Computing Could Be The Next Big Thing - Investor's Business Daily After Artificial Intelligence, Quantum Computing Could Be The Next Big Thing  Investor's Business Daily",neutral,0.9406732320785522,0.0
RGTI,Rigetti Computing Inc,2024-02-27,2024-02,google,3 Millionaire-Maker Quantum Computing Stocks to Buy in February 2024 - Yahoo Finance 3 Millionaire-Maker Quantum Computing Stocks to Buy in February 2024  Yahoo Finance,neutral,0.9045993685722351,0.0
RGTI,Rigetti Computing Inc,2024-02-27,2024-02,google,SpringWorks Therapeutics Reports Fourth Quarter and Full Year 2023 Financial Results and Highlights Recent Business Updates - Stock Titan SpringWorks Therapeutics Reports Fourth Quarter and Full Year 2023 Financial Results and Highlights Recent Business Updates  Stock Titan,neutral,0.9217160940170288,0.0
RGTI,Rigetti Computing Inc,2024-03-14,2024-03,google,"Already Up 104% YTD, Wall Street Predicts This Quantum Computing Stock Will Surge Another 58% - Nasdaq Already Up 104% YTD, Wall Street Predicts This Quantum Computing Stock Will Surge Another 58%  Nasdaq",positive,0.9390255212783813,0.9390255212783813
RGTI,Rigetti Computing Inc,2024-03-11,2024-03,google,Rigetti Computing: A Buy Despite Low Revenues In An Emerging Field (NASDAQ:RGTI) - Seeking Alpha Rigetti Computing: A Buy Despite Low Revenues In An Emerging Field (NASDAQ:RGTI)  Seeking Alpha,neutral,0.5750129222869873,0.0
RGTI,Rigetti Computing Inc,2024-04-15,2024-04,google,3 Stocks to Buy for 100X Gains Before the Next Tech Hype Cycle - InvestorPlace 3 Stocks to Buy for 100X Gains Before the Next Tech Hype Cycle  InvestorPlace,neutral,0.8089100122451782,0.0
RGTI,Rigetti Computing Inc,2024-04-24,2024-04,google,Quantum Computing Stocks: An Investment in the Future - Value The Markets Quantum Computing Stocks: An Investment in the Future  Value The Markets,neutral,0.9455163478851318,0.0
RGTI,Rigetti Computing Inc,2024-04-26,2024-04,google,The Top 3 Quantum Computing Stocks to Buy in April 2024 - InvestorPlace The Top 3 Quantum Computing Stocks to Buy in April 2024  InvestorPlace,neutral,0.9339479804039001,0.0
RGTI,Rigetti Computing Inc,2024-04-27,2024-04,google,3 Quantum Computing Stocks That Could Be Multibaggers in the Making: April Edition - InvestorPlace 3 Quantum Computing Stocks That Could Be Multibaggers in the Making: April Edition  InvestorPlace,neutral,0.9365034699440002,0.0
RGTI,Rigetti Computing Inc,2024-05-28,2024-05,google,"Do Hedge Funds Like Rigetti Computing, Inc. (NASDAQ:RGTI) As A Quantum Computing Play? - Yahoo Finance Do Hedge Funds Like Rigetti Computing, Inc. (NASDAQ:RGTI) As A Quantum Computing Play?  Yahoo Finance",neutral,0.940440833568573,0.0
RGTI,Rigetti Computing Inc,2024-05-22,2024-05,google,3 Quantum Computing Stocks That Could Be Millionaire-Makers: May Edition - Nasdaq 3 Quantum Computing Stocks That Could Be Millionaire-Makers: May Edition  Nasdaq,neutral,0.9295045137405396,0.0
RGTI,Rigetti Computing Inc,2024-05-03,2024-05,google,Stock Market Crash Warning: Don't Get Caught Holding These 3 Quantum Computing Stocks - InvestorPlace Stock Market Crash Warning: Don't Get Caught Holding These 3 Quantum Computing Stocks  InvestorPlace,neutral,0.7697793245315552,0.0
RGTI,Rigetti Computing Inc,2024-05-16,2024-05,google,3 Secret Quantum Computing Stocks Flying Below Wall Street’s Radar - Nasdaq 3 Secret Quantum Computing Stocks Flying Below Wall Street’s Radar  Nasdaq,neutral,0.9322165250778198,0.0
RGTI,Rigetti Computing Inc,2024-05-20,2024-05,google,7 Cheap Quantum Computing Stocks to Buy Now: May 2024 - InvestorPlace 7 Cheap Quantum Computing Stocks to Buy Now: May 2024  InvestorPlace,neutral,0.9169154167175293,0.0
RGTI,Rigetti Computing Inc,2024-05-29,2024-05,google,7 Stocks You Haven’t Heard of (That EVERYONE Should Own) - Yahoo Finance 7 Stocks You Haven’t Heard of (That EVERYONE Should Own)  Yahoo Finance,neutral,0.947044849395752,0.0
RGTI,Rigetti Computing Inc,2024-05-06,2024-05,google,10 biggest quantum computing companies in the world [2025] - Finbold 10 biggest quantum computing companies in the world [2025]  Finbold,neutral,0.9259867072105408,0.0
RGTI,Rigetti Computing Inc,2024-06-12,2024-06,google,3 Quantum Computing Stocks That Still Have Sky-High Potential - InvestorPlace 3 Quantum Computing Stocks That Still Have Sky-High Potential  InvestorPlace,neutral,0.912757158279419,0.0
RGTI,Rigetti Computing Inc,2024-06-26,2024-06,google,IonQ: Requires A Quantum Leap To Be A Success (Rating Downgrade) (NYSE:IONQ) - Seeking Alpha IonQ: Requires A Quantum Leap To Be A Success (Rating Downgrade) (NYSE:IONQ)  Seeking Alpha,neutral,0.8567876219749451,0.0
RGTI,Rigetti Computing Inc,2024-06-21,2024-06,google,Is Absci Corporation (NASDAQ:ABSCI) the Best Halal Stock According to Hedge Funds? - Yahoo Finance Is Absci Corporation (NASDAQ:ABSCI) the Best Halal Stock According to Hedge Funds?  Yahoo Finance,neutral,0.7951081395149231,0.0
RGTI,Rigetti Computing Inc,2024-06-27,2024-06,google,Top 10 Non-Silicon Computing Companies - Securities.io Top 10 Non-Silicon Computing Companies  Securities.io,neutral,0.9505323767662048,0.0
RGTI,Rigetti Computing Inc,2024-07-26,2024-07,google,Get Your Money Out of These 3 Quantum Computing Stocks by 2025 - InvestorPlace Get Your Money Out of These 3 Quantum Computing Stocks by 2025  InvestorPlace,neutral,0.940773069858551,0.0
RGTI,Rigetti Computing Inc,2024-07-31,2024-07,google,Could Rigetti Computing Become the Next IonQ? - The Motley Fool Could Rigetti Computing Become the Next IonQ?  The Motley Fool,neutral,0.9293480515480042,0.0
RGTI,Rigetti Computing Inc,2024-07-04,2024-07,google,3 Quantum Computing Stocks With Strong Buy Ratings: Summer 2024 - Yahoo Finance 3 Quantum Computing Stocks With Strong Buy Ratings: Summer 2024  Yahoo Finance,neutral,0.7909557819366455,0.0
RGTI,Rigetti Computing Inc,2024-07-24,2024-07,google,3 Quantum Computing Stocks With Big Breakout Potential - Barchart.com 3 Quantum Computing Stocks With Big Breakout Potential  Barchart.com,neutral,0.8560662865638733,0.0
RGTI,Rigetti Computing Inc,2024-07-16,2024-07,google,3 Quantum AI Stocks That Could Redefine Computing - Nasdaq 3 Quantum AI Stocks That Could Redefine Computing  Nasdaq,neutral,0.9228690266609192,0.0
RGTI,Rigetti Computing Inc,2024-07-24,2024-07,google,3 Quantum Computing Stocks With Big Breakout Potential - The Globe and Mail 3 Quantum Computing Stocks With Big Breakout Potential  The Globe and Mail,neutral,0.7671926021575928,0.0
RGTI,Rigetti Computing Inc,2024-07-17,2024-07,google,7 Quantum Computing Stocks That Could Be Multibaggers in the Making: July Edition - InvestorPlace 7 Quantum Computing Stocks That Could Be Multibaggers in the Making: July Edition  InvestorPlace,neutral,0.936806857585907,0.0
RGTI,Rigetti Computing Inc,2024-07-15,2024-07,google,10 Best Quantum Computing Stocks to Buy in 2024 - Analytics Insight 10 Best Quantum Computing Stocks to Buy in 2024  Analytics Insight,neutral,0.8939803242683411,0.0
RGTI,Rigetti Computing Inc,2024-08-08,2024-08,google,SoundHound acquires Amelia AI for $80M after it raised $189M+ - Yahoo Home SoundHound acquires Amelia AI for $80M after it raised $189M+  Yahoo Home,neutral,0.7571852803230286,0.0
RGTI,Rigetti Computing Inc,2024-08-12,2024-08,google,"KLCI Back Above 1600, Bursa Malaysia Bounces Back - AskTraders.com KLCI Back Above 1600, Bursa Malaysia Bounces Back  AskTraders.com",neutral,0.5197423100471497,0.0
RGTI,Rigetti Computing Inc,2024-09-17,2024-09,google,Rigetti Computing faces potential Nasdaq delisting - Investing.com Rigetti Computing faces potential Nasdaq delisting  Investing.com,neutral,0.8955551981925964,0.0
RGTI,Rigetti Computing Inc,2024-09-30,2024-09,google,"IonQ Improves Its Tech, Pushes Closer To Commercialization (NYSE:IONQ) - Seeking Alpha IonQ Improves Its Tech, Pushes Closer To Commercialization (NYSE:IONQ)  Seeking Alpha",positive,0.9501877427101135,0.9501877427101135
RGTI,Rigetti Computing Inc,2024-09-20,2024-09,google,CEOs quitting at record pace. Here are some of the latest - Yahoo Home CEOs quitting at record pace. Here are some of the latest  Yahoo Home,negative,0.836742103099823,-0.836742103099823
RGTI,Rigetti Computing Inc,2024-10-04,2024-10,google,Quantum Companies D-Wave and Rigetti Again Face Stock Delisting - HPCwire Quantum Companies D-Wave and Rigetti Again Face Stock Delisting  HPCwire,neutral,0.7001587152481079,0.0
RGTI,Rigetti Computing Inc,2024-10-25,2024-10,google,Rigetti Computing (RGTI): Top Quantum Computing Stock with 143.9% Upside - Yahoo Finance Rigetti Computing (RGTI): Top Quantum Computing Stock with 143.9% Upside  Yahoo Finance,neutral,0.9268646240234375,0.0
RGTI,Rigetti Computing Inc,2024-10-07,2024-10,google,"Quantum computing firms D-Wave and Rigetti face stock exchange delisting, again - Data Center Dynamics Quantum computing firms D-Wave and Rigetti face stock exchange delisting, again  Data Center Dynamics",negative,0.5262842774391174,-0.5262842774391174
RGTI,Rigetti Computing Inc,2024-10-07,2024-10,google,Quantum Computing Giants D-Wave and Rigetti Once Again Face Delisting Over Low Stock Prices - The Quantum Insider Quantum Computing Giants D-Wave and Rigetti Once Again Face Delisting Over Low Stock Prices  The Quantum Insider,neutral,0.6188096404075623,0.0
RGTI,Rigetti Computing Inc,2024-10-18,2024-10,google,The Quantum Computing Revolution is Here: 3 Top Stocks to Watch - Yahoo Finance The Quantum Computing Revolution is Here: 3 Top Stocks to Watch  Yahoo Finance,neutral,0.9495794773101807,0.0
